group_id,qc_label,conversation_id,active_days_14d,active_days_30d,retention_14d,mentee_n_edits,mentee_n_edits_7d,mentee_acct_age_hours,reply_words,reply_lag_hours,question,reply
15,qc_32,3849,3,7,1,5.0,5.0,26.0,29.0,13.4,How do I publish an article?,Hi Volkan Agha and welcome to Wikipedia. [HELP_PAGE] explains how to publish a draft article. My welcome message on includes additional links that provide guidance on how to edit.
15,qc_32,33267,0,0,0,0.0,0.0,0.0,3.0,0.5,How do I publish an article,@: See [HELP_PAGE].
15,qc_32,8971,0,0,0,0.0,0.0,0.5,140.0,2.1,How do I publish article,"Adefila Oluwatimileyin Ayomide thanks for the question and welcome to Wikipedia! Creating a new Wikipedia article is very difficult because it requires experience in lots of different skills. The most important stage is the research stage, where you need to find sources and [POLICY]; when you have reliable sources, you need to assess whether they [POLICY]. If you decide your topic is definitely notable then you need to summarise the sources in your own words, making sure the reader can [POLICY]. Then, you need good writing skills and the ability to format using [POLICY] so the article is readable. Newcomers should start with tasks that help them develop the necessary skills one at a time, some of which are recommended on . The ideal is to start by adding reliable sources to existing articles that are in poor shape. —"
15,qc_32,18943,0,0,0,0.0,0.0,0.6,29.0,105.5,How do I publish an article?,"Hey, [POLICY] is a great introduction to editing and using Wikipedia in general. You can create a new article and submit it for creation at [POLICY]. Hope this helps,"
16,qc_34,30605,5,7,1,3.0,3.0,47.2,12.0,0.1,how do i create my user page,"AestheticArtist
You can create [POLICY] yourself. Click edit tab to edit it."
16,qc_34,30490,0,0,0,1.0,1.0,3.0,17.0,28.4,How do I create my user page,It looks like you have started. I recommend to read the guide at the following link: [HELP_PAGE]
16,qc_34,13848,0,0,0,0.0,0.0,0.2,24.0,15.0,How do I create my user page,"@: Hey there! I've left additional info on , but please see [POLICY] for a list of ways to appropriately use your user page."
16,qc_34,4827,0,0,0,2.0,2.0,0.7,21.0,39.0,"Hi, I'm D.D.B2024,
How can I create a user page?","Hi @, your userpage is this page here: --this is where you can tell other editors what you are interested in."
17,qc_53,11575,3,3,0,0.0,0.0,0.1,45.0,24.3,How do I make my own article?,"Ey, [POLICY] is an extremely bad idea per the link in this sentence, if that's what you mean. I really doubt that your team meets our [HELP_PAGE]. There is very little benefit for the subject when they have a Wikipedia article, and there are [POLICY]."
17,qc_53,12730,0,0,0,0.0,0.0,0.1,17.0,176.3,How do I create my own article,"@: Writing an article about yourself is generally [POLICY] due to potential [POLICY]. Otherwise, try [HELP_PAGE]. ([WIKILINK]/[WIKILINK])"
17,qc_53,5390,0,0,0,0.0,0.0,0.1,15.0,0.4,how do I create my own article?,"@, here is some reading material:[POLICY], [POLICY], [POLICY] and, if it applies, [POLICY]. Good luck!"
17,qc_53,18534,0,0,0,0.0,0.0,0.1,12.0,88.1,How do I make my own article about myself,"@ - Please do not do that, it is against wikipedia rules."
18,qc_57,37052,5,5,1,1.0,1.0,0.3,51.0,49.9,Hi. How do I make my profile?,"Hi there,
I would like to write articles on education, skills, employability, wellness, politics, etc. Where do I start?
ShahinRezaBD Hello, and welcome to Wikipedia. You can learn about how to write good articles by reading [POLICY], but I would recommend you begin by editing articles already present on the website."
18,qc_57,33431,0,0,0,0.0,0.0,0.1,34.0,2.5,"Hello
How do I create my profile?","Hi @, welcome to Wikipedia! To create your userpage, please look up “User:” followed by your username in the search bar and click on “Create Source”. Thanks and happy editing! Best, ( • )"
18,qc_57,1130,0,0,0,0.0,0.0,0.1,14.0,47.3,how to make my profile,"I don't understand what you mean. This is an encyclopedia, not a social network."
18,qc_57,22394,0,0,0,0.0,0.0,0.0,41.0,5.8,How do I create my profile?,", to create your [POLICY], click on the red name in your signature. If you are trying to create a Wikipedia article about yourself. this is not recommended and will likely result in failure. You should read through [POLICY] to start."
19,qc_59,15111,5,7,1,8.0,8.0,69.7,27.0,1.2,Hey i wanted to edit a page. It needs to be renamed. How can I do that ? Please help,"It's not going to be renamed because ""Kartavya Path"" is nowhere near close to becoming the [POLICY] of the road, which is the relevant Wikipedia policy here."
19,qc_59,1494,14,24,1,1.0,1.0,0.3,30.0,5.3,"Hello there, I just finished an edit and want to know how to rename the title of a page?","To change the title of a page, it needs to be moved from the old title to the new one. You can find out how to do this at [HELP_PAGE]."
19,qc_59,28777,0,0,0,0.0,0.0,1.0,27.0,40.5,"Hey there, how do I rename my page?","Hi @, I can do it for you. What page is it and what do you want it to be renamed to, and why? ( • )"
19,qc_59,16291,0,0,0,0.0,0.0,0.0,10.0,4.3,Hi. How do i rename the page,Arriestudios There is a guide for moving a page [POLICY].
20,qc_78,17434,4,4,1,3.0,3.0,22.1,13.0,5.2,"Hi. Can I able to create a new page for company on Wikipedia.
Share your tips regarding this.",Balakumar93j hi! Do you have a [POLICY] regarding the company? ( · he/him)
20,qc_78,23420,0,0,0,0.0,0.0,0.0,116.0,0.7,"Hello, how can I create a company page on Wikipedia?","@ welcome to Wikipedia! I would strongly discourage you from creating a company page, because creating your first article without much editing experience is extremely difficult and if it is a company that you share a conflict of interest with, please also read through at the very least the lead section (first 4 paragraphs) of [POLICY] regarding COIs, also read through [POLICY] and go through some of the links I've posted on your talk page. If you instead want to want to focus on making Wikipedia a better place, perhaps choosing another [POLICY] would be a better idea. Thanks, and feel free to reply to this message if there is anything you don't understand, happy editing!"
20,qc_78,8664,0,0,0,1.0,1.0,43.6,36.0,16.1,hello sir I need your help for create new page for company wikipedia,"Yv1515, does the company that you want to create an article about have significant coverage outside of sources connected to the company itself? Also, do you have any connection to this company at all? (Very Busy)"
20,qc_78,31692,0,0,0,0.0,0.0,0.0,29.0,0.1,Hi. I want to create a Wikipedia page for my company. How can I do that?,"Hi, ! Welcome! Writing articles on subjects you're connected with isn't allowed, especially about companies. Please read our policy on [POLICY]. You should also disclose any paid editing. Thanks!"
21,qc_91,37787,4,9,1,1.0,1.0,0.1,23.0,0.0,"Hello, How do I add a source to a piece of info?","Hi @ - have a look at this: [HELP_PAGE] - if you need any more help feel free to ask me more. Regards,"
21,qc_91,2726,0,0,0,0.0,0.0,-1.0,23.0,0.1,"Hello, How do I add a source to a piece of info?","Hi @ - have a look at this: [HELP_PAGE] - if you need any more help feel free to ask me more. Regards,"
21,qc_91,12348,0,0,0,3.0,3.0,0.6,6.0,65.3,How do you add sources within the information you're editing?,@: I'd recommend checking out [POLICY].
21,qc_91,18947,0,0,0,1.0,1.0,0.0,26.0,5.9,I edited before but? How do I add a source,"Hey @, this page: [POLICY] has a tutorial on how to add sources. If you have any more questions please let me know! Hope this helps,"
22,qc_99,34287,5,7,1,0.0,0.0,0.3,66.0,10.2,how do I edit a page,"Hi there! In order to edit a page, you can click the ""edit source"" tab on the upper right corner of the page and change the Wikipedia article text to what you need to change it to. Also, please feel free to take a look at our [POLICY] as well as our [HELP_PAGE], [POLICY], [POLICY] and [POLICY]. Again, welcome and happy editing! Thanks, ( • )"
22,qc_99,40285,4,5,1,0.0,0.0,0.2,23.0,0.0,How can I edit page,"hi, you can edit pages by clicking the Edit or Edit source button at the top of an article or by clicking [LINK]"
22,qc_99,15292,0,0,0,0.0,0.0,0.0,19.0,19.5,how do I edit a page,Qwerty.qwertymeow There's a great introduction to editing at [HELP_PAGE]. Let me know if you have any other questions! '
22,qc_99,25519,0,0,0,0.0,0.0,0.1,51.0,0.0,"hello, how to edit a page?","[LINK]
Kuyhaacracks1812 Hello, Welcome on Wikipedia! If you don't known how to edit a page, then firstly please see [HELP_PAGE] and You're name is seem like organization name, and it's not match to Wikipedia's [POLICY] policy, so, please request for change you're name by filling this . Happy editing!. ~~ |"
22,qc_99,18169,0,0,0,0.0,0.0,0.6,74.0,11.8,hi! how do you edit a page?,"Hi Galaxystarzx989 and welcome to Wikipedia! There should be an ""Edit"" button on most articles here. If you can't find it, you can add ""?action=edit"" to the end of the URL. Pages may be protected, and in those cases, you won't be able to edit them unless you reach a certain number of edits. I hope this helps, and feel free to let me know if you need any more help. Happy editing! :)"
