cluster,pair_rank,pair_id,role,retention,outcome,cid,mentee_dist,emb_cosine_sim,question_text,reply_text,question_words,reply_words,mentee_name,mentor_name
6,4,c6_p4,A,high,1,16896,0.4625,0.6806,How do i put images form my gallery?,"Hi, I'm not totally sure what you mean. If you want to upload images you have taken then do so though the [LINK].",8,23,KeyMen12,Pickersgill-Cunliffe
6,4,c6_p4,B,low,0,22533,0.4625,0.6806,How to insert image,"if the image you are trying to add is not uploaded, see [POLICY]. Note the restrictions on file uploads are very strict to comply with CC-BY-SA. Once it is uploaded see [HELP_PAGE] to insert it on the page. Hope this helps.",4,41,300000kmpersecond,Sungodtemple
7,0,c7_p0,A,high,1,31942,0.0,0.5334,How do I publish a refined and cited article of anything I please? I would like a guide on how to do the codework and imagery.,see [POLICY].,26,2,SoftTacoss,Tankishguy
7,0,c7_p0,B,low,0,27720,0.0,0.5334,Hello. I have a research manuscript I would like to publish. I look forward to your guidance on the process. Best regards.,"@: Hi, Wikipedia does not publish research as it is an encyclopedia, not a journal. You may want to look into the traditional academic publishers or [WIKILINK]. Ping me!",22,29,Mukhtar Muhammad Ahmad Sharaf al-Din,ARandomName123
7,1,c7_p1,A,high,1,39899,0.2312,1.0,I created an article today and I don't know if its going to get exepted or when how long is the typical wait process,Hi,24,1,933y,Pbsouthwood
7,1,c7_p1,B,low,0,6175,0.2312,1.0,I created an article today and I don't know if its going to get exepted or when how long is the typical wait process,"The draft has no references, so it cannot be verified, and you have not submitted it for review, so no-one is likely to check it and it will be assumed you are still working on it. The typical wait for an article that is both adequately referenced and submitted for review is highly variable, and depends on the topic and who feels like taking a look. Please read [HELP_PAGE] for advice and a better idea of how things work here. Geographical units like rivers are usually uncontroversial and pass review relatively easily if the article lists [POLICY] :",24,97,Tif3307wiki,Pbsouthwood
7,2,c7_p2,A,high,1,14840,0.4907,0.5742,"How can I add new information, publish new content?","@: The article about the subject already exists at [WIKILINK]. If you want to add more information about it, [POLICY] and add it yourself, but make sure to back up your addition with a [POLICY] (see [HELP_PAGE] for help on referencing). -- (, , )",9,44,Jxstin670,Leonidlednev
7,2,c7_p2,B,low,0,4893,0.4907,0.5742,"Hello dear, how do I need to proceed for my article to get published? Thank you","Hi @, welcome to Wikipedia. I assume you're talking about [DRAFT], right? As a general rule, biographies are accepted [POLICY]. So e.g., news articles or magazine profiles of Siska would fulfill this requirement, but profiles published by the museums he works for do not. Right now, I don't think any of the references in the draft would meet this criteria, and articles are usually accepted only when they have 2-3 of them.
Side note, given your signature, are you Siska? We strongly discourage people from writing about themselves--[POLICY]. It's very possible that reviewers will reject the article just based on that.",16,101,Color Club Lab,Alyo
7,3,c7_p3,A,high,1,7076,0.5077,0.5662,"Hi Sdkb, what's your best advice for someone who's new here and wants to learn how to edit and publish new articles?","My advice is not to start with creating new articles; go build up some experience with other [POLICY] first. Then, when you're ready, read [HELP_PAGE] and follow its advice, particularly about sourcing. Cheers,",21,33,RICHAOBO1,Sdkb
7,3,c7_p3,B,low,0,13786,0.5077,0.5662,Hi there. I have my article written and need to know the next step,Jessicabayleafagency It looks like a reviewer has given you feedback on the draft at [DRAFT]. Let me know if you have any additional questions.,14,23,Jessicabayleafagency,Bsoyka
7,4,c7_p4,A,high,1,35918,0.5096,0.462,"Hello I hope you are well. I would like to publish an article about a person, I have references and would like your input if it meets criteria. Thank you.","Lebootimes, take a look at [POLICY] and [POLICY]. After you read through that, you can submit your article at [POLICY]. I'm not sure what your article is, so I can't provide specific input however.",30,33,Lebootimes,Zoozaz1
7,4,c7_p4,B,low,0,965,0.5096,0.462,"Hello, I can't get to build my first article (a new page).
I press publish and nothing happens. Not sure why.","Hi @. I've seen a few other users report this bug. I would recommend copying all your article content to an external editor (like Microsoft Word) as there is no auto save function on the Wikipedia editor and I don't want you to loose your work. Then, restart your browser and perhaps try clearing your cache before trying again?
If you still have no luck, report this to [POLICY] so that the more technically-minded users can look into it. '",21,80,Flippinfliper,Qcne
8,0,c8_p0,A,high,1,26957,0.0,0.751,How do I setup a new page,"@: To set up a new page, create a draft through the [POLICY]. You can either practice creating a draft in your sandbox, or you can click on ""Next"" and follow the steps to create a draft in the ""draftspace"". Once you've chosen the draft's name, proceed to insert the article's contents, splitting them into different sections using headings: ==Heading name here==. Regards,",7,63,Select Films Assistant,Nythar
8,0,c8_p0,B,low,0,27159,0.0,0.751,I want to create a page,@ see [HELP_PAGE].,6,3,Udayrajsinghaparajit,CanonNi
8,1,c8_p1,A,high,1,40574,0.2764,0.6467,Hey! I was just wondering how I would start a new page for a person who does not have one? Thank you!,"@ Sorry for the late response, but you can start with [HELP_PAGE] and the [POLICY]. v/r -",22,16,WestonTallman2,Seawolf35
8,1,c8_p1,B,low,0,10409,0.2764,0.6467,how do I make a page?,"Fordeum, see the [POLICY] guide, and follow the instructions of the Article Wizard tool on that page.",6,16,Fordeum,Fritzmann2002
8,2,c8_p2,A,high,1,6313,0.3027,0.7634,How do I create a page?,"Hi . Just a quick reply before I head off to bed tonight: Pages can be created about [POLICY], but not just about any old stuff you happen to know or like. If you tell be the type of topic (person, place, film, musician, species, nebula, etc, I can point you to the relevant notability criteria (such as [POLICY], [POLICY], [POLICY] etc).
You can create a draft article either in your personal sandbox or as a proper [POLICY] and submit it for review and feedback when you think it's finally ready to go into the main part of the encyclopaedia. Please follow guidance and use the 'Article Creation Wizard' at [POLICY]. Everything you add to a page must be based upon properly published, good quality [POLICY]. Follow the hyperlinks for all the information you will need to get you started. Regards, and good luck!",6,143,Jrmango,Nick Moyes
8,2,c8_p2,B,low,0,1887,0.3027,0.7634,"Hi, how do I create new content? I have created a script for piano called Pianoscript. I would like to create a page for it. Thanks","@ Hello and nice name! You can give [HELP_PAGE] a read, but honestly if it's for a script you made, better to leave it to others .. as you'll quickly see, wikipedia frowns on promotional articles - that's covered on [POLICY]. Cheers,",26,41,Celtiberi,Mujinga
8,3,c8_p3,A,high,1,29989,0.303,0.694,"omg hey
how do i create a page?","@, Hello and welcome to Wikipedia! I see that you haven't been given a welcome template yet so I am going to shoot one over to you! But, you can read how to get started at [HELP_PAGE]!",8,37,Birdknowsmoreaboutmikuthanyou,Cowboygilbert
8,3,c8_p3,B,low,0,24474,0.303,0.694,"how to create a professional
page","Hi , you can learn about creating a new article at [HELP_PAGE].",6,11,Saint9140,1AmNobody24
8,4,c8_p4,A,high,1,16471,0.3042,0.6545,hello how to make a page,"Hi , welcome to Wikipedia!
Creating an article from scratch is very difficult, and it may be a frustrating experience because you need to be familiar with a lot of different policies & guidelines on how to write appropriate content for Wikipedia. It‘s not usually recommended for new editors, but it‘s entirely allowed. [POLICY] provides guidance for new users on writing an article, including some of the more technical aspects. I suggest you read through that, as well as some of the policies it links to. I‘d be happy to help you with any questions.
There is a basic requirement for standalone article topics called [POLICY]. In most cases, that means that independent and reliable sources need to have published significant content on the subject.
Something else to be aware of is that it's generally not a good idea to create articles about yourself, your family or friends, or a company or organization that you work for or with. That's mainly because it's extremely difficult to write from a [POLICY] in such cases. You can read more about conflicts of interest [POLICY].
I know it can be discouraging to have all these guidelines thrown at you, but please don‘t let it dissuade you from editing here on Wikipedia. Meanwhile, it may be good to go around and improve existing articles to learn the ropes. If you see something wrong, don‘t worry too much about knowing all the guidelines; be [POLICY] and fix it! Happy editing! :) ,",6,244,Catlover1519,Actualcpscm
8,4,c8_p4,B,low,0,34135,0.3042,0.6545,"Hi, how can I create a page about a band? Thanks","Hi Andrejkrestan welcome to English Wikipedia.
Once you are logged in, click on the ""Create new article"" link in the top right corner of the page. In the search bar, type in the name of your band. If there is no existing page for your band, you will be able to create a new one.",11,54,Andrejkrestan,Aryan
9,0,c9_p0,A,high,1,3840,0.0,0.5991,How do I create an article introducing a character?,Hi Ninjagofandomorg and welcome to Wikipedia. [POLICY] is information on how to create an article and [POLICY] is information regarding notability of fictional characters.,9,23,Ninjagofandomorg,Rosiestep
9,0,c9_p0,B,low,0,14721,0.0,0.5991,Hello! How can I make a new article in here?,See [POLICY],10,2,Saarlane saaremaalt,Kingsif
9,1,c9_p1,A,high,1,22455,0.0,0.604,"Hello, when can I start writing a new article?",", to answer your question, you can start writing a new article whenever you want.
However, note that you can't create an article directly in 'mainspace', or where viewers see it. Instead, there is a technical restriction which only allows you to create a new article directly when you are [POLICY] - that is, your account has existed for four complete days and made ten edits.
Furthermore, creating a new article is one of the most difficult things you could possibly do on Wikipedia, only made even more arduous since you are a new editor. This would be akin to attending a chess competition having just learned what the rules are.
If your mind is set on creating a new article, I highly recommend you spend some time (at least a few days) making edits suggested at , then reading [POLICY] very carefully and creating a draft. Also note that creating articles is generally not the best way you can contribute to Wikipedia.
Lastly, if you are being [POLICY] to edit Wikipedia or have a [POLICY] with your planned article subject, then you should read the relevant guideline/policy, which are linked earlier in the sentence. Happy editing!",9,195,Californiawriter,Sungodtemple
9,1,c9_p1,B,low,0,14590,0.0,0.604,"Greetings. I want to add an article on digital marketing, could you please guide me how i do so",follow these instructions exactly: [HELP_PAGE],19,5,Digital Market Tags,Jenhawk777
9,2,c9_p2,A,high,1,23344,0.1514,0.6648,How can I creat article which will approved easily.,"Hi , welcome to Wikipedia! You've asked a quite broad question and I need more details (like what subject you intend to write the article on, what sources you have gathered) to provide a more specific answer. In general, [HELP_PAGE] is quite a good place to start. However, I believe most new articles by newer users end up not being published, especially if you have a [POLICY] with the subject. It is likely to be a waste of time and if you are interested in contributing in general, I would recommend going through [HELP_PAGE] and picking a task in our [POLICY].",9,100,Kabilavutto,Justiyaya
9,2,c9_p2,B,low,0,11339,0.1514,0.6648,"Hello 👋
How do i create an article","@ Welcome! Creating a new article from scratch is extremely challenging, and new editors are strongly recommended to spend a few months learning how Wikipedia works, by making improvements to some of our existing seven million articles before trying it. When you do decide to have a go at a new article, you are highly encouraged to read [HELP_PAGE]. If you haven't already also check out [POLICY]; it's a lot of fun! Happy editing! ~ (he/him • )",8,74,Mobi Mech,Shushugah
9,3,c9_p3,A,high,1,12523,0.1514,0.4493,Hi there. How do I insert headings in the articles?,"Hello Alfie5890, and welcome to Wikipedia! I think [LINK] addresses how to add headings. Basically, you select the text that should be a heading, and then change ""Paragraph"" to ""Heading"" in the upper toolbar. There are a lot of different ways to add headings: a shortcut I personally use is to enter a new line, and then type == (two equal signs) and it will start making a heading. (Use three equal signs for a subheading, etc.) If you have any trouble or want me to look at the article you're working on, just let me know! Happy editing!",10,98,Alfie5890,LEvalyn
9,3,c9_p3,B,low,0,19304,0.1514,0.4493,"Hola, puedo crear un artículo de fútbol",":Derek021222 Welcome to Wikipedia! Unfortunately, I do not understand the language you have written in. Google Translate says it's Spanish, and the translation is ""Hello, can I create a football article"". Yes, you can! As long as the subject of the article is [POLICY] and the article is supported by [POLICY].
If you don't speak English, I would advise you contribute to the [WIKILINK] instead. You can also find help from Spanish speakers at [POLICY].
Si no hablas inglés, te recomiendo que contribuyas a [WIKILINK]. También puede encontrar ayuda de hablantes de español en [POLICY]. (traducido por Google)",7,97,Derek021222,Liu1126
9,4,c9_p4,A,high,1,23669,0.1514,0.7384,hi pls how can i start my own article writting,Nifesco12 See [HELP_PAGE]. ( · · ),10,2,Nifesco12,Snowmanonahoe
9,4,c9_p4,B,low,0,20665,0.1514,0.7384,How do I create an article?,"Welcome to my talk page, Calvinn5. I have posted links to your talk page that will help you understand how to write and article. If you have further questions please let me know.",6,32,Calvinn5,ARoseWolf
10,0,c10_p0,A,high,1,4971,0.1514,0.5038,"Hello Alyo,
I am a new Wikipedia editor. I thought of a couple of questions before starting:
1) Do references need to be used in the text to be listed in the References section?
2) If I add text in the middle of an existing entry, with a new reference, will references later in the text be renumbered automatically?
Thanks in advance for sharing your guidance!
PSU-TRS88","Hi @, these are great questions! To answer simply: yes (generally) to both of your questions. When you edit wikis, there are certain types of code that will automatically do most of this for you. You should read [POLICY], but when you use ... tags (with the citation in between the tags), the citation will automatically be numbered and added to a list at the end of the page. The list is generated wherever the template is placed, so just make sure that template exists--it's usually in the References section.",65,89,PSU-TRS88,Alyo
10,0,c10_p0,B,low,0,29163,0.1514,0.5038,I wanted to add an item to a bibliography,"Mills, Marry Hello and welcome to Wikipedia! Could you please give me the url of the specific page you want to add an item to, so I can give more tailored advice? Sincerely,",9,33,"Mills, Mary",Grumpylawnchair
10,1,c10_p1,A,high,1,23390,0.1685,0.3921,"Hi. Thanks for taking the time to help me out. I recently edited created a page on Wikipedia entitled Blooprint. Could you provide some constructive criticism on it?
I am new to research + citations, and using them in an appropriate manner. Hence, I feel critical feedback is important.
Thanks in advance","Hi @, [WIKILINK] seems to have been deleted. If you think that the subject is [POLICY], feel free to post some of your sources below. If you don't think the subject is notable, I don't think going forward with the article is a good idea. You might want to find another [POLICY] to work on.",52,55,Zapperz0398,Justiyaya
10,1,c10_p1,B,low,0,2536,0.1685,0.3921,Hello! I was just interested in asking if correcting grammar mistakes is okay. I have found an end quote without a defined start quote.,"@ yes. correcting grammar mistakes is okay, and even expected.",24,10,Barodaian,Robertsky
10,2,c10_p2,A,high,1,37683,0.2312,1.0,"Hello! An article I was directed to edit had someones D index instead of H index, which is usually more relevant. In cases like these, do I keep the D index, delete the D index in favor of the H index, or include both even though it may be redundant?
i.e. in general, is additional information like this too redudnat to keep?","Koryphaea Help me out here — what's a D index v. an H index? Which article are you talking about? And, you say you were directed to edit an article, were you by chance to be compensated in any way to do that, per chance?",62,45,Elytraflagpole,Glane23
10,2,c10_p2,B,low,0,4569,0.2312,1.0,"Hello! An article I was directed to edit had someones D index instead of H index, which is usually more relevant. In cases like these, do I keep the D index, delete the D index in favor of the H index, or include both even though it may be redundant?
i.e. in general, is additional information like this too redudnat to keep?","Koryphaea Help me out here — what's a D index v. an H index? Which article are you talking about? And, you say you were directed to edit an article, were you to be compensated in any way to do that, per chance?",62,42,Koryphaea,Glane23
10,3,c10_p3,A,high,1,25115,0.3027,0.4374,"I have recently created a wikipedia account. My aim is to provide more articles on different species of ants, or extending them past being a ""stub"". My question is, can I use antwiki (another reliable wiki) as a cited source or should I use their sources to write articles?","@, Firstly I'm not trying to come off harsh here, but if you closely paraphrase or copy the content when the license doesn't support it, secondly I would use the sources they cite as a wiki itself isn't a reliable source because many people can edit it. (they/them)",49,47,FranticSpud,Zippybonzo
10,3,c10_p3,B,low,0,25683,0.3027,0.4374,"Hello!
I'm wondering about the editing policy on small pages, and how to properly source things (if sourcing is even required)
I'm in the Canadian Coast Guard, and i enjoy reading the wikipedia page of the various vessels in the fleet. However I've noticed some of the information on certain vessels is wrong, or outdated.
I have no idea how to properly source that, there wouldn't be articles written about a system overhaul on a midsized vessel. The only evidence I have is what I've seen with my own eyes on these ships. I'd like to share my knowledge about the ships on wikipedia, but I want to do it in a way which is in accordance with the Wikipedia standards.
Thanks!
-Soapbottle","Hi @, welcome to wikipedia! Can you give an example of a couple of the changes you'd like to make? It might be the sort of thing we can find primary sources for, but it might also be the kind of thing that we probably shouldn't have on the encyclopedia anyway, since it's not easy enough for someone to verify.",122,60,Soapbottle,Asilvering
10,4,c10_p4,A,high,1,36669,0.3027,0.3276,"Hello,
I'm looking to edit a local politician's wiki (also a family member) who's information is sorely lacking. I was wondering if I could cite county records and ancestry.com when discussing this person's early life.",":DreadPirateRoberts1 Hi, and welcome to Wikipedia! First of all, I would strongly caution you against making edits to the article of a person whom you have a family connection with; see [POLICY] for more info on that front. Regarding the sources you mentioned, county records may be ok if used with caution. Wikipedia tries to stick to [POLICY], as [POLICY] are generally less reliable. See also [POLICY], which states that primary sources like county records should not be used to support personal details (e.g., date of birth). Wikipedia has a blurb about Ancestry's reliability [POLICY] - the consensus is that it is generally unreliable, and thus should not be used as a source.
Let me know if you have any other questions. Again, thanks for your interest in editing Wikipedia! '",35,130,DreadPirateRoberts1,AviationFreak
10,4,c10_p4,B,low,0,35419,0.3027,0.3276,"Hi! What is the protocol for links within an article to other wikipedia pages that are only loosely relevant to the originating article (which I see on occasion).
Purely as an example, let's say there's a page about a fashion model and within that article there is this sentence; ""Jane Smith began her modeling career when she was discovered by a Ford Modeling Agency executive on her way to the grocery store to buy bread."" There might be interlinks to wikipedia pages for ""grocery store"" and ""bread"". These links don't appear to be necessary or really add anything of value since what is being linked to is only nominally relevant to the article where the links originate from and virtually everyone knows what a grocery store is and what bread is.
Alternately, let's say you have an article about corner stores or bodegas, which still exist and were the precursors to grocery stores. In an article like that, you would expect to see ""grocery store"" linked to if the text appeared somewhere in the article because it's highly relevant to the content on the page where the link is originating from. Linking to ""grocery store"" in the context of a page about bodegas (via which readers can find out how they're related, the differences, etc.), makes perfect sense here where in the article about a model, linking to ""grocery store"" serves no real purpose.
Are there any rules to this or preferred protocol? Thanks.","@ My thoughts are that words like ""grocery store"" and ""bread"" should be known to the target reader of Wikipedia, and it's also tangentially related to Janes modeling career, so it doesn't make sense to link it. In your second example, linking to ""grocery store"" makes sense, if barely so, since it's more related to the topic at hand.",244,59,Aschn8787,I dream of horses
11,0,c11_p0,A,high,1,18561,0.0,0.3251,"Good morning. A recent article about the potential antibiotic ""aubacin"" references ""Paul Coy's"" recent article in the New York Times. The author's correct name is ""Peter Coy.""
Thank you,
-Eric","Hi @!
I can't seem to find the article you're referring to. If you still know where it is, [POLICY] and change it yourself! Happy editing,",30,26,Ericssharps,Estar8806
11,0,c11_p0,B,low,0,11156,0.0,0.3251,"Hello, I'm new at Wikipedia, how can I be of use I'm a dedicated young researcher.
Kind Regards
Mthlis Edward","@ welcome to Wikipedia! What topics are you interested in? Get a hang of how Wikipedia editing works, and focus on topics you're interested in. You can also find a list of [POLICY] with likeminded editors interested in same things as you. Happy editing! I also enclosed some helpful links on your User talk page ~ (he/him • )",20,55,Mthlisi Edward,Shushugah
11,1,c11_p1,A,high,1,3291,0.0,0.212,"Hello. I'm the Tourism Director in Detroit Lakes MN with the Tourism Bureau, located in the Chamber of Commerce building. I'd like to update some Detroit Lakes info that is no longer correct, please. Thanks, Cleone","Visitdetroitlakes Hi, first, declare your conflict of interest on your user page. This [POLICY] contains information on how this is done. When you have a conflict of interest, it is recommended that you make an [POLICY] to the article you wish to change. Finally, there is a problem with your username, as it goes against our policies here; see [POLICY]. This must be changed to something like “Cleone at VisitDetroitLakes”, since accounts cannot be shared or represent an organization or company.",36,80,Visitdetroitlakes,Shellwood
11,1,c11_p1,B,low,0,5880,0.0,0.212,"Hello, how do I create a Wikipedia page for Author Oakley Dean Baldwin?","Hello, The Baldwin Stories. Given your user name, the first thing that you need to do is declare your [POLICY]. Please be aware that promotional activities are not permitted on Wikipedia. Then familiarize yourself with the [POLICY] and the specific [POLICY] and other creative professionals. Next, do in-depth study of [POLICY].",13,48,The Baldwin Stories,Cullen328
11,2,c11_p2,A,high,1,1879,0.0,0.3811,"hi Muiinga, i wish to add myself to the page 'irish rap' with the following link information
[LINK]
thanks, cathal",@ hi and welcome to wikipedia! writing an article about yourself is strongly discouraged- please give [POLICY] a read. The problem is we all have a tendency to inflate our achievements; much better to leave it until someone else makes it then feel free to point out any errors.,20,49,Cathaloreilly,Mujinga
