cluster,pair_rank,pair_id,role,retention,outcome,cid,mentee_dist,emb_cosine_sim,question_text,reply_text,question_words,reply_words,mentee_name,mentor_name
11,2,c11_p2,B,low,0,20544,0.0,0.3811,"Hello, I would like to write a page for the Tout Finira Bien band, existing since 10y, who just released their 3rd album. Could you help me?","Hello, Louis1070, and welcome to Wikipedia! I see you've [WIKILINK], so I think you'll find the process very similar over here. One difference is that the English Wikipedia doesn't let brand-new users create articles directly: instead, you can use the [POLICY], which will show you how to create a draft and submit it for another editor to review. You might also want to look at [HELP_PAGE], which provides helpful information about the expectations for new articles. Make sure to include good citations: they can be in any language, but they do need to talk about the band in detail and be from trustworthy, independent sources. Let me know if you have any questions.",27,112,Louis1070,Extraordinary Writ
11,3,c11_p3,A,high,1,17761,0.0,0.2938,"Greetings, I was editing many years ago under the username: ChachaScholar. I wished to sign back in under that name, but I no longer have access to my old email. Therefore, I saw no option but to open a new account. As the only archaeologist who has excavated and written extensively about the Peruvian archaeological sitef of Gran Pajaten and Manachaqui Cave (Chachapoyas Culture), I sometimes look to see if my older entries have been replaced by pseudoarchaeology and/or false, politically-motivated entries. I have no need to replace either (if that is against Wikipedia policy), but I would like to see the scientifically demonstrated, peer-reviewed narratives represented. For example, I note that the majority views of professional academic archaeologists is not represented in the entry for Chachapoyas Culture. Thank You. Warren Church, Ph.D.","Hi @ - welcome back! It will be great to have you back in the community! The first thing I would recomment is setting up a User page (you should see that icon in red under your name) - please state that exactly what you explained above, that you no longer had email access so have a new account. I would link to this page: [LINK]
In terms of editing, I would look at the [POLICY] which help guide people with research interests and specialist knowledge. You might also want to say hello on the talk page of [POLICY] several editor there are also concerned with pseudoarchaeology. Any questions feel free to get in touch. Happy editing!",133,117,ArchaeoChacha,Lajmmoore
11,3,c11_p3,B,low,0,29513,0.0,0.2938,")]]
Hi, I have a PILE of documents and history including all the private ship newsletters from the battlecruiser USS GUAM from WWII.
I don't know how to get in touch with the person who seems to have the most edits on the page for the Guam.
What should I do?
Can you email me at my email on file?
Thanks",Hello @ and welcome! It's probably best to discuss adding these sources at the article's respective talk page. See [HELP_PAGE] and the image for guidance. Happy editing!,61,27,ElementalBreakdown,NotAGenious
11,4,c11_p4,A,high,1,1223,0.1514,0.2639,"Hello, just looking to edit an article on my grandfather ""Joseph Moureau."" (Belgian pilot from WW2). There are two things that I wish to add. The first is that he died of Covid in 2020 in Brussels - can I add this information being his grandson or do I need a reference from a source online? Second, his younger brother Xavier was recently honored at Flossenburg concentration camp for the upcoming 80th commemoration of its liberation (link is [LINK] the individual source in the video (Agnes Moureau) is the younger sister of both Joseph and Xavier. Is this legitimate to include as a mention on Joseph's page e.g. ""Joseph's younger brother Xavier made the attempt to reach England in 1942 but was caught by the Gestapo in France and subsequently registered as a political prisoner and was imprisoned in various concentration camps including Dachau, Sachsenhausen, etc etc"". Many thanks for your time and advice!","You always need a reference for a death, and it stands to reason anyone worthy of note to have a Wikipedia article about them will have a source confirming the date of death, especially if it's in the last 15 years or so. I assume the Flossenbürg source is an official source that can be considered reliable for claims about itself; the best advice I can give is [POLICY], and if it [POLICY] on the article's talk page.",154,78,MoureauBelge75,Ritchie333
11,4,c11_p4,B,low,0,11839,0.1514,0.2639,"Oi, bom dia! Queria criar uma página para um homem que contribuiu para Campo Maior, no Piauí. Ele foi um economista e contador brasileiro. Nós da prefeitura queríamos fazer uma página em sua homenagem…como faço?","Hello @, welcome to Wikipedia. Please send your messages in English language.",35,12,Alicemoraisreisdantas,Idoghor Melody
12,0,c12_p0,A,high,1,33860,0.0,0.4388,"Hi - I want to edit a company page to include more up to date information. What should I be aware of, and what kind of sources should / can I quote?
Thank you for your help!","Hello @! You should try and use sources that are not tied to the company. Newspapers and journals would be appropriate, but something from the company itself - such something on their website - would not. Hope this helps you! ( · )
Thank you for the quick answer, very helpful!
No problem! ( · )",37,50,Fenryr85,Phoenix
12,0,c12_p0,B,low,0,19781,0.0,0.4388,"Hey buddy, I am looking to create a wikipedia article about my company Ready Set Exec Inc. as well as add some edits to name us for results about Executive search and recruitment. What do you recommend?","@ I don't recommend you do that. See [POLICY]. If you insist, see [POLICY] ! ? [LINK].",37,15,ReadySetExec,Scaledish
12,1,c12_p1,A,high,1,24409,0.0002,0.6296,"Hey! Im Maxime, I would like to create a Wikipedia page for my company, any recommendations on the process? :) thank in advance
Best,
Maxime","Hi @, If your company is notable enough, I recommend starting by creating a Draft using [HELP_PAGE]. Either way you should take a look at [POLICY] as it applies to you.",24,31,Maxime Bonningue Vaia,1AmNobody24
12,1,c12_p1,B,low,0,2596,0.0002,0.6296,"Hello I want to upload a new wikipedia page about myself, Lara Smith, CEO of listed Antimony Company and written several articles and given key note addresses on critical metals.
Please advise how to get started.","@ If you are notable per [POLICY], someone else will write about you. I suggest reading through [POLICY] before embarking on this endeavour by yourself. As for writing other articles, you are welcome to write as long as there is no [POLICY]. I have dropped a bunch of links on your talk page which can guide you through your editing journey.",36,61,Larajt.smith005,Robertsky
12,2,c12_p2,A,high,1,859,0.0025,0.4876,"Hello,
I work for a business that currently doesn't have a wikipedia page. As digital marketing assistant, I've been asked to write one.
Even if referencing reliable sources and declaring a COI, would you recommend finding a neutral party to write this for us?
Regards
Jake","Hi Wpdigital, edits where there is a conflict of interest need to be clear, so I would not recommend getting someone else to create the article. [POLICY] edits aren't encouraged, but the least-bad approach is probably to (a) [WIKILINK] on your User page, create the article as [DRAFT] or whatever, also add a Connected Contributor declaration on the Draft's Talk page, and then submit it via [WIKILINK] for independent assessment.",46,69,Wpdigital,AllyD
12,2,c12_p2,B,low,0,22028,0.0025,0.4876,"Hi there!
I wanted to get your help on the best way to create a new wikipedia page for a company I am affiliated with. I'm suggesting the creation of a Wikipedia article for Zumper, a rental marketplace founded in 2012 and based in San Francisco. Zumper has been mentioned in the Real estate trends article ([LINK] in reference to its role as an online rental listing service and is the only company mentioned without a standalone article.
The company has received significant coverage from reliable sources such as TechCrunch, Crunchbase News, The Real Deal, and Inc. It has raised $180 million in funding from investors like Kleiner Perkins, Andreessen Horowitz, and Blackstone, and was also recognized as one of Inc.’s Best Workplaces in 2019 and 2020 ([LINK]
Given these points and its inclusion in existing Wikipedia content, I believe a dedicated article is warranted. I have a neutral draft prepared with citations and am looking for help from experienced editors to review and possibly create the article.
I am affiliated with the company and will not post the article directly myself, in accordance with Wikipedia’s conflict of interest guidelines.
Do you have any advice on this?
Thank you!","ZumperCrystal Welcome to Wikipedia. You posted to [POLICY] about creating this article and you might have luck there. But, you can also start a draft for this company yourself if you want, at [DRAFT]. Make sure you read and follow the steps in [POLICY] first though. I'm also assuming that [POLICY] applies to you, so follow those steps as well. Once you create the draft, please feel free to reply back here, so that I can take a look and provide pointers, if any.",199,83,ZumperCrystal,MPGuy2824
12,3,c12_p3,A,high,1,11709,0.1514,0.5299,"Hello, I’m new to Wikipedia and interested in creating a biography article about a notable entrepreneur who has been performing exceptionally well in the business world. I noticed their photo is available on Wikimedia Commons and there’s a Wikidata profile as well. Could you please guide me on how to start a draft for a new article and what sources I should use to meet Wikipedia’s notability criteria?","Alex261995, the page at [HELP_PAGE] breaks down what you need to know. The main point is that you need a few reliable sources that are independent of the subject. Press coverage from major publishers is good, but things like interviews or company websites should be used sparingly and don't count toward notability. The other main thing to keep in mind is the [POLICY]. Make sure the article doesn't sound like it's celebrating the person or highlighting their successes. Wikipedia is especially strict about this on people related to business because there are many who misuse Wikipedia as a way to promote themselves. There are also [POLICY] if you know the person or are connected to them in some way. If you have the necessary sources and there's enough to write a neutral description of the person, then you can start at the [POLICY]. You're also welcome to practice editing by fixing problems on already existing articles, or to ask questions at [POLICY], which is a page specifically for new editors.",68,169,Alex261995,Thebiguglyalien
12,3,c12_p3,B,low,0,24359,0.1514,0.5299,How do I create a Wiki page for a company?,"Hi , [HELP_PAGE] has some insight for that, especially the notability section.",10,11,Gregoryprice,1AmNobody24
12,4,c12_p4,A,high,1,20729,0.2089,0.5875,"Hi,
So I mostly joined up because I saw an article that was kinda indefensible for its presence but made me interested in adding the company I work for as a business page. Company is 30 years old, fairly major player in its industry and the founders have received an MBE for their work.
I've written up the text but I'm cautious to make sure it's relevant enough to be on Wikipedia and I know it's usually poor form to write about yourself and don't know if this would qualify.
Can you give me a steer?","@: Hi and welcome to Wikipedia! Hopefully my answer will encompass everything you should have taken care of – but sadly I don't see the text (you probably haven't uploaded it yet) so my judgment and advices will be perhaps quite general.
The main concern you should have as an editor is being connected to the subject (the company). This is regulated by [POLICY] policy which states you should disclose all connections (furthermore, if you're being paid to create this article please see [POLICY] as well). Next question, which is probably one of the most important steps when creating an article is proving it is notable. Every subject must pass the [POLICY] criteria and (in your case) [POLICY] policy as well – and you prove that by having enough in-depth independent [POLICY] on the subject (see also [POLICY] on how to format them). I know I have provided you lots of policies etc. but rest assured article creation is one of the hardest tasks a newcomer could undertake.
Since you have conflict of interest, you'll need to publish a draft through [POLICY], where in case your content wouldn't be compliant with Wikipedia policies, you'd get feedback on how to improve it. Best case, your draft gets accepted.
I think I gave you the outline of everything you'd need to be concerned about, however if you have any further questions please do not hesitate to ask. Best regards, '|",96,238,JimmyHartill,A09
12,4,c12_p4,B,low,0,27248,0.2089,0.5875,"Hello,
We want to create a wikipedia page for our company to provide the generic information about it. Please guide.
Thank you.",:Please read [POLICY].,22,3,Qualifiedcontentcreator,Cremastra
13,0,c13_p0,A,high,1,30896,0.2113,0.5275,"Hi,
I want to edit a new page on Adam Linder. He is a famous choregraph that already has various article on national newspapers. I wanted to upload a picture of him through wikimedia commons, and I was spamed by the antiparasite bot. But me and his team had sent a mail to wikimedia to release the right to use the file.
Is everything else that I can do ?
Thanks for your help
Simon","Unfortunately, I don't think there is much but to await WikiMedia's response. In the meantime, you can continue working on your article and feel free to let me know with further questions. Or, possibly, get Linder/his team to release the photograph into the public domain. (By the way, you were not ""spammed"" by the bot, haha.)
Out of curiosity, why are you working on your page in the French Wikipedia? Since it is written in English, perhaps this Wiki would be better.
Also - friendly reminder about Wikipedia's [POLICY] and [POLICY] regulations, which require that you declare conflicts of interest and/or being paid to write an article if that is the case.
Cheers, and welcome!",74,115,Simononwiki1,GoldRomean
13,0,c13_p0,B,low,0,8024,0.2113,0.5275,I want to add a picture for wikipedia to use,"Hi, @! If this is your own original work (your own photograph, artwork, etc.), then you can upload the file via [WIKILINK], and it will be available for use on the English Wikipedia as well. If this isn't your own original work, then unfortunately we can't accept that type of photo without additional considerations. You can ask the [WIKILINK] on Commons if you'd like specific guidance on what Commons allows. ([WIKILINK] • )",10,70,Catterpiller8967,Chlod
13,1,c13_p1,A,high,1,28805,0.3809,0.4387,"Hi there Cocobb8! Thanks so much.
I'm actually wondering how to get a 'confirmed' wiki account?? I followed the verify account instructions, but for some reason it's not letting me upload photos in order to use them in wiki pages.","Hi @! Having your email address verified won't allow you to upload an image just yet. What you need instead is for your account to be [POLICY], which will happen automatically once your account is both 4 days old and you have made at least 10 edits. Once that is so, you should be allowed to upload an image. In the meantime, you can check out [POLICY] for how to use images once they are uploaded! Let me know if you have additional questions! Cheers, ( • )",39,85,TrevorGaeillan,Cocobb8
13,1,c13_p1,B,low,0,19912,0.3809,0.4387,"Hello, I am looking to add to an page of a ship that I work on. I Would like to add some pictures that the average public wouldn't normally get to see. but I'm not sure how to add images.","@ Hey there @! It seems like you have access to some useful imagery. To upload images under a free use license, the best and easiest way to do so is to upload them to [LINK], Wikipedia's public domain library of images and videos. You'll see the big ol' upload button there. Make sure you're certain your images meets the criteria for being 100% free; be sure to click any links to guidelines along the way if you need help. •",40,80,Charon870,Panini!
13,2,c13_p2,A,high,1,18537,0.5077,0.2744,"Hey, was just watching a documentary about Cartels in Mexico and then sought out some of the Wikipedia pages for some of the bosses. I noticed Miguel Ángel Félix Gallardo didn't have a picture. So, when I went to edit and add a picture I was sent down a rabbit hole with copyright issues. If I find an image how do I tell if its copyrighted and if its safe to upload?","Hi @,
Thanks for asking this question. It's very important that we don't infringe on copyright laws. Generally speaking, most photos are copyrighted, except for those that are in the public domain. It's best to play it safe and not upload images that you're unsure of, though I would check out [POLICY] for our relevant policies.",72,56,Ii Nova ii,Estar8806
13,2,c13_p2,B,low,0,21886,0.5077,0.2744,"How do I add a photo to a Wikipedia page? I have a photo of a painting by Samuel Cutler Hinckley of his father, Samuel Lyman Hinckley.
Thank you.
Sam Hinckley",Hinckleyfilm Welcome to Wikipedia. To upload an image use the most appropriate button in [POLICY]. Following that you can add the image to a Wikipedia page. You can take a look at [HELP_PAGE] for that. Please contact me if you face any issues. Happy editing!,31,44,Hinckleyfilm,MPGuy2824
13,3,c13_p3,A,high,1,40789,0.5096,0.6333,How do I upload images I've taken onto Wikipedia?,"Hi @. First of all, if you want to make your pictures widely available (and be able to use them on English Wikipedia), you should probably upload them to [WIKILINK], the instructions for which are [WIKILINK]. If you actually want to upload them to English Wikipedia only, then you should use the [POLICY]. Hope that helps! Cheers,",9,57,DownscopeTheBoatCaptain,SunloungerFrog
13,3,c13_p3,B,low,0,31989,0.5096,0.6333,"Hello good evening from here
Please I will like to know how to write about my stories post cultural pictures and links on wikipedia","If you want to write an article, look at [POLICY]. It can help you with the processes.
For images, there are two ways to do that: you can upload here, in the English Wikipedia, but also in another place called Wikimedia Commons (this one is preferred, if you're uploading your own images). For Wikimedia Commons, just see the [WIKILINK]. If you have any more questions, please ask! 🫀 ( it / he    )",24,73,Ugo79,Organhaver
13,4,c13_p4,A,high,1,31944,0.5297,0.3978,"There's an image that's been used for a public figure that makes me 99% sure it's public domain, and I'd like to use it on the page. How do I make officially sure it's up for public grabs so I don't get in trouble?","I'm.... Not sure. You should probably ask the fellows over at Commons, They can probably help you out.",44,18,Groovium,Tankishguy
13,4,c13_p4,B,low,0,11596,0.5297,0.3978,"Hi, how do I add an image to a wikipedia page?","Looks like you figured it out! Check out [HELP_PAGE] for a tutorial. In particular, [POLICY] says captions should only have ending punctuation (like periods) if they are complete sentences and should not be bolded. Sometimes, [POLICY] have their own places for you to place images.",11,45,CourtneyPleass,Aaron Liu
14,0,c14_p0,A,high,1,14153,0.0,0.5529,Hello! I just would like to add a link to my name in a couple of Wiki pages I'm mentioned in.,Letsgetloudmusic Good day. Please provide your name that is referenced in Wikipedia articles.,21,12,Letsgetloudmusic,Cassiopeia
14,0,c14_p0,B,low,0,30504,0.0,0.5529,Can I edit any random page on WIkipedia ?,You should be able to edit most articles. What do you want to do?,8,14,Kevin Ugeini,Reconrabbit
14,1,c14_p1,A,high,1,1506,0.0,0.5284,Hi I'm new to the this place.i do know that the articles in Wikipedia are easily changeable and I wanna stop that. Can you help me do this maybe plus I'm a mobile user,"Welcome! Wikipedia is the encyclopedia that anyone can edit, including you. I'm not sure what you are asking for here, but if you have any questions about Wikipedia, you can ask me, or you can ask at the [POLICY] or the [POLICY].",34,42,Goofygoober-is-keir,Iffy
14,1,c14_p1,B,low,0,4294,0.0,0.5284,"Hi! I was looking at this wikipedia page here recently and noticed that it had been put up for possible deletion.
[LINK]
It was eventually decided not to but it was agreed the page was overall pretty low quality. I used to go to this place as a kid and have been compiling information on this location and other places in the area like it in hopes of making the page better. I've never edited a Wikipedia page before and was hoping to get some help on how to proceed.","Well that deletion debate took place over 17 years ago which is an eternity around here. If you read the actual debate, the complaints were that the Center was not [POLICY] and that parts of it were copied from a copyrighted source. From what I understand, the copyright issue was settled during or just after the end of the debate. As for the notability question, it's also sorted out since there are plenty of references to reliable sources in the current article. If you want to edit the article, just hit the ""Edit"" tab. Please remember that content should be [POLICY] and therefore based on [POLICY] rather than your own subjective memories of the place. This means handling sourcing which can be tricky for newcomers. So go ahead and make changes you think make the article better, and ring me up when you get to the stage where you're adding references and finding it difficult. (or, for that matter, ask any questions you may have about editing!) Cheers,",90,168,Mordrayus,Pichpich
14,2,c14_p2,A,high,1,27235,0.0,0.6706,"Hi, I am new here. I have knowledge of HTML. Can I edit wikipedia? How to edit and how I should start?","@ hi. Yes, you are absolutely welcome to edit Wikipedia! [HELP_PAGE] would be a great place to start.",22,18,Arbaz Thakur,CanonNi
14,2,c14_p2,B,low,0,5303,0.0,0.6706,"Hello sir ,
How i can edit and update new informations and how i also can add my site to wikipidia","@, hello! I recommend you to start with [POLICY] and [POLICY].
Making an acceptable WP-article without knowing how to edit WP is hard. A common advice is to ""just"" edit for a while first, to try to get a hang of this place.
That said, your first hurdle is ""Can a WP-article about your chosen subject be written at all?"" Start with reading [POLICY]. If you conclude ""Yeah, I have those sources, no problem!"", move on to [POLICY]. If your choice of topic fails [POLICY], the article will not be accepted. If you decide to go ahead, you need to learn how to add references correctly, [POLICY] can help with that. This is crucial, and I can't stress that enough. Really. If you intend to write about a living person, read [POLICY]. If you intend to write about yourself ([POLICY]), the short advice is ""don't.""
Hope this helps some.",20,149,Neshar 00,Gråbergs Gråa Sång
14,3,c14_p3,A,high,1,23403,0.0,0.4376,"Hello, How do I edit or create articles, and how do I add photos, citations, references, etc, etc. The only reason I am asking you this is vecause I want to gelp wikapedia to help others.","Hiya @, welcome to Wikipedia. I would usually recommend starting with [HELP_PAGE]. There are usually help pages associated with what you are asking. I would recommend starting with [HELP_PAGE] and [HELP_PAGE]. Feel free to ask me about the specifics if needed.",36,41,"Eamonn A, Lalor",Justiyaya
14,3,c14_p3,B,low,0,3729,0.0,0.4376,"I love Wikipedia and want to support. Where does Wikipedia need the most manpower?
Thank you!","Hi @! I don't know that there is any real ranking of where Wikipedia needs manpower. I would instead dive in according to your interests/abilities. [POLICY] is a good place that has places to help grouped by type of task, but I'd also recommend just looking at articles of interest to you and thinking about how they could be improved. (E.g. do they need to be copyedited? Dubious unsourced material removed? Citations identified and added?)",16,75,Jason.mc99,Calliopejen1
14,4,c14_p4,A,high,1,34672,0.0,0.4968,"Hi there!
My name is Stephanie and I am trying to create a Wikipedia page for a candidate that is running for President in the 2024 election. I have already done my research, obtained my citations and created the content. Is there a way to submit or do I have to go through a process before it can be reviewed for publish? Thank you for any assistance!","If you have more than 15 edits and your account is 4 days old, you can publish articles by yourself without needing a secondary review, where readers can access it. It will still be reviewed by [POLICY]. [POLICY] and [POLICY] are great essays for crafting your first article.
If you have [WIKILINK] with the candidate (such as working for the campaign, being paid, close personal connection, etc), you have to go through the [POLICY] process, where you can submit your draft for others to review. Just a heads up though: the queue is very long currently.",67,96,Clown Atlas,Ca
