cluster,pair_rank,pair_id,role,retention,outcome,cid,mentee_dist,emb_cosine_sim,question_text,reply_text,question_words,reply_words,mentee_name,mentor_name
7,1,c7_p1,A,high,1,20887,5.8284,0.3366,How to add battle,"Hi @, I don't quite understand your question, can you elaborate? Best regards! [WIKILINK]",4,14,Huseynqalkovskiyie,Sunny Cryolite
7,1,c7_p1,B,low,0,29155,5.8284,0.3366,How do I upload information?,"Munyaradzi Savanhu What do you mean by ""upload information""?",5,7,Munyaradzi Savanhu,Grumpylawnchair
7,2,c7_p2,A,high,1,31741,7.3831,0.6613,hi i am a new editor i want to know to how to add,See [HELP_PAGE]. ([TALK_PAGE]),14,3,Chinmay dokania,Tenshi Hinanawi
7,2,c7_p2,B,low,0,7637,7.3831,0.6613,"hello
how i can add my content","Not by overwriting your mentor's talk page, that's for sure. See [HELP_PAGE].",7,12,Sahajdip kaur,Usernamekiran
7,3,c7_p3,A,high,1,27116,7.5578,0.5539,How do you add the following information?,@ Sorry I do not understand your question. Please be more clear.,7,12,EdricLhow22,Maliner
7,3,c7_p3,B,low,0,4858,7.5578,0.5539,Is it possible to add new content??,@ of course! Looks like you've done that right [LINK]!,7,10,Zpr159,Alyo
7,4,c7_p4,A,high,1,11907,9.0547,0.6605,"Hi, what should I add?","Hello, @, welcome to Wikipedia. Do you have anything in mind to fix in the [WIKILINK] article?",5,17,W3rn3rMilk,Idoghor Melody
7,4,c7_p4,B,low,0,453,9.0547,0.6605,How do I add a new entry?,"Hello HydroMaker2. Not clear exactly what you're asking so i'll answer what i assume: How to start an article? Your best bet is to look at [POLICY], which has all sorts of guidance for new editors such as yourself. If this is not answering the question you meant, please feel free to ask me more, i'm happy to help if it can ~",7,61,HydroMaker2,LindsayH
8,0,c8_p0,A,high,1,38324,3.9284,0.7989,blud how do i make an article,"Caro pro corvo, I'm going to refer you to [HELP_PAGE]. There, you should find a how-to guide for writing an article; the first step is to determine whether your article subject is appropriate for Wikipedia.",7,32,Caro pro corvo,Iseult
8,0,c8_p0,B,low,0,37023,3.9284,0.7989,How to make an article?,"Hello, and welcome to Wikipedia! Creating a new page is a very difficult process, since it involves a lot of research, writing, and understanding of encyclopedic content guidelines. If you're interested in a topic, I'd recommend you first edit some existing pages to get a feel for how Wikipedia works.
However, if you really do want to create a new article, then there's some great advice at the page [HELP_PAGE]. In a nutshell, make sure that the topic has coverage from [POLICY] reliable sources, that you're writing in a neutral way, and that you're citing all your sources. I've a left a message on your talk page with a link to some useful resources. If you have any follow-up questions, I'm happy to answer them.",5,125,BaraaGamerYT964,Crestfalling
8,1,c8_p1,A,high,1,24390,4.3344,0.7688,how to make an article,"Hi , you can learn how to create a new article here: [HELP_PAGE].",5,12,JustiJust6017,1AmNobody24
8,1,c8_p1,B,low,0,32507,4.3344,0.7688,"LOOK AT THIS!!!
Hi, mentor. How do I make an article?","If you want to start an article, see [HELP_PAGE] and start an article via [POLICY] when you're ready.",11,18,MikiPedia33,Rusty Cat
8,2,c8_p2,A,high,1,30880,4.4647,0.8692,How do i make a article,"Hi, please see [HELP_PAGE] and let me know if you have any questions. You can not directly make an article yet, you will have to create a draft and submit it. Cheers,",6,32,Lucia1234avc,GoldRomean
8,2,c8_p2,B,low,0,2829,4.4647,0.8692,Hi how can I make my own articles?,"Hi @ - I've left a set links which provide a full introduction to Wikipedia on your [TALK_PAGE] - have a look through those and feel free to come back to me with any questions. Regards,",8,36,Onibungipussi,Goldsztajn
8,3,c8_p3,A,high,1,25882,4.8776,0.9146,How do I try to make an article,"Hi @, welcome to wikipedia! Have you read [POLICY]?",8,9,Redstar0005,Asilvering
8,3,c8_p3,B,low,0,27509,4.8776,0.9146,How do I make an article,"@: Hi! To make an article, please follow the step-by-step instructions in the [POLICY]. This creates a draft. Once you have completed it, you can submit it for review, where an experienced editor will check to see if it meets our [POLICY]. This involves checking if the subject of your article has been the subject of [POLICY], [POLICY] by [POLICY]. If it meets this guideline, it will be accepted, if not, it will be declined and you will be able to make improvements. Please see [POLICY] for more helpful information.
Happy editing, and thanks for your interest in contributing! Ping me!",6,101,Cman cat con,ARandomName123
8,4,c8_p4,A,high,1,17168,4.9889,0.7513,How do I make an article?,"hi @ and welcome to Wikipedia! there's a bit of reading material needed before you can start an article:
[POLICY], which discusses what sources you can use to back up claims and things you write in the article (since said claims are required in all but the [POLICY] claims you make),
[POLICY], which discusses if the subject you're writing can have an article,
and [POLICY], which actually gets you in the process of writing your own article.
it's not an easy process, so it's alright if you want to tackle some [POLICY] first and return to this in the future, but if you want to work on one now, here's what you need to start writing a draft for your article. happy editing!",6,123,Don't be sad be happy,Pahunkat
8,4,c8_p4,B,low,0,3325,4.9889,0.7513,hoiiw do i make a draft to a article,"@: see [POLICY] for advice, or you can go straight to the [POLICY].",9,13,Whhhqwe,DoubleGrazing
9,0,c9_p0,A,high,1,2229,0.5117,0.9319,How do I create a new article?,@ this is the link to read - [POLICY],7,9,Peaseal23,Mujinga
9,0,c9_p0,B,low,0,24536,0.5117,0.9319,"Hi,
I want to make a new article. How do I create one?","Hi , [HELP_PAGE] should help you with that.",13,7,ErlendSten,1AmNobody24
9,1,c9_p1,A,high,1,25739,1.0235,0.9626,Hello. How do l create a new article?,"Hi @, welcome to Wikipedia! Creating a new article is as easy as going to [POLICY] and typing the title of your new article. But it's also a really quite difficult for someone to do when they're new to wikipedia, so I recommend you don't do that yet. Have a look at [POLICY], the links I just dropped on your talk page, or explore the options in your newcomer homepage first to get a feel for the place, and you'll find creating an article a much easier step.",8,88,SAlrich Williams,Asilvering
9,1,c9_p1,B,low,0,30666,1.0235,0.9626,"Hello,
How can i create a new article?","Hello, @. Please read the [POLICY] and [HELP_PAGE] before creating new article. Thank you. • [WIKILINK]",8,16,Iliya N. Andrew,KuyaMoHirowo
9,2,c9_p2,A,high,1,14877,2.3953,0.7841,How to create new article,"@: To start writing an article, please see [HELP_PAGE]. It is recommended that you start writing in your userspace or draftspace. (, , )",5,23,Ms!a!am!aszqwswzw,Leonidlednev
9,2,c9_p2,B,low,0,19254,2.3953,0.7841,"Hello, How do I create an article? I don't see and option in the site map/menu.","You cannot create an article, because you are not [POLICY].",16,10,Vividtman,Dege31
9,3,c9_p3,A,high,1,9691,2.9333,0.919,Hello how do I crate an article???,"create*
Hi , have a look at [HELP_PAGE]. In short, you should make sure the subject of your article doesn't already have one, that it's covered by reliable secondary sources, and that you aren't connected to it. Article writing is hard, so you might find it helpful to try an to get used to editing first. [WIKILINK]",7,56,Blahblehblah69,WindTempos
9,3,c9_p3,B,low,0,30497,2.9333,0.919,"Hi, how can I create a new article.",I would read [HELP_PAGE]. What do you want to write an article on?,8,13,Pulp and Paper Science,Reconrabbit
9,4,c9_p4,A,high,1,29690,3.7143,0.7559,Can I create an article without starting with a draft?,"@, yes in some cases, but for you, no. To be able to create articles in the mainspace (without starting as a draft), you must be [WIKILINK], or in other words have had an account for at least four days and made at least ten edits (which you have made). Cheers! '",10,52,Viviennemarina,JayCubby
9,4,c9_p4,B,low,0,6784,3.7143,0.7559,"Hi! I want to create new articles, how can I do that?","Lovedesserts Hi and welcome to Wikipedia. Writing an article is the hardest task to do on Wikipedia, and it is strongly recommended to gain experience editing articles that have already been created. But, if want to begin writing a draft of an article, you can follow the instructions [POLICY] and begin your article by using the [POLICY].",12,56,Lovedesserts,Cyberdog958
10,0,c10_p0,A,high,1,26805,0.305,0.6343,"Hello!
Really new to editing! Was wondering if you could share some first steps?","Hello @ and welcome! If you want to familiarize yourself, a good tip is to start by editing existing articles rather than writing new ones from scratch. When you add content, the most important thing to remember is to cite a source – [HELP_PAGE] has some tips on how to do it. The only place where sources aren't needed is the lead (first paragraphs before the sections), which summarizes what is already sourced in the body. The homepage menu next to your userpage should have examples of articles in need of fixing, if you want to take a look. Orange banners on top will indicate what the issues in need of fixing are. Although you don't have to edit these articles in particular, of course! And articles with orange banners aren't the only ones in need of editing: pretty much any article can be improved! If you want a few more tips, [POLICY] that can be useful. Best of luck!",14,160,Annimukh,Chaotic Enby
10,0,c10_p0,B,low,0,12594,0.305,0.6343,Hey there. Any guides for new people who want to help contribute to editing?,"Hi Nuclear8563, and welcome to Wikipedia! I left a message on your Talk page with some helpful getting-started links. My own go-to tip is to find a really good book or a magazine article about something you're interested in, and use it to add information to articles on Wikipedia. Another good introductory task is to check out [WIKILINK]. You don't (or shouldn't) need to do any research to fix these articles - most of them are here because they are tagged with ""lead too short"". Find one of those, read the article, then rewrite the lead so it summarizes it accurately. Now you can remove the ""lead too short"" tag. Done! Since the ""lead"" is what is shown in Google Search results and so on, this is an immediately helpful and visible change. If you have any questions as you're exploring, feel free to ask me or (for a speedier response) the many helpful editors at the [POLICY] forum.",14,158,Nuclear8563,LEvalyn
10,1,c10_p1,A,high,1,25426,0.6101,0.6645,"Hi, so nice to meet you! Any recommendations for edits to begin with? I am currently picking out the topics I am interested in. Any advice would be amazing! How do I access instructions for different templates? I'm kind of going in here blind so would really appreciate ""how to"" forums, etc.","Hello, Spindella000! Lovely to meet you as well! Wikipedia is pretty broad, so you can edit (pretty) much anything you'd like it just depends what you're interested in! Your offers suggested edits based on topics, but you can also take a look at [POLICY], which are collections of Wikipedians interested in certain topics and resources they've collected about them. Many are inactive or semi-active, but they should still have some resources, and often a section of articles you can improve in that area as well. Or if you're more interested in a type of edit rather than a type of article, there's lots of those too! I find [POLICY] and [POLICY] really satisfying, and adding references to unverified information is hugely helpful, but you can find other kinds as well at the [POLICY]. And for any and all newcomer questions you have, definitely visit the [POLICY], especially if I'm not around! There's a lot of hosts there who can answer pretty much any editing question you have.
As for templates, there's usually instruction pages associated with each one if you search ""Template:"" followed by the template name (like [QUOTE] Template:citation needed [/QUOTE]), you can find more information there.
I know that's a lot of information, so please feel free to ask any further questions you may have! I see you've already been welcomed by another Wikipedian, but I'll drop my mentor welcome on as well it has a few more links you may find helpful. Welcome to Wikipedia, and happy editing!",52,250,Spindella000,Perfect4th
10,1,c10_p1,B,low,0,16165,0.6101,0.6645,"Hey,
Do you have any tips on editing and creating for new users?","Hi @, its easier to begin with pages you are familiar with or pages that talk about things that interest you. You could begin with as little as adding a coma where you deem necessary or even a full stop. You can click [HELP_PAGE] to learn more. Please let me know if it helps.",13,54,M29NZX,Kinvidia
10,2,c10_p2,A,high,1,26249,1.1839,0.5825,hello what would be a good community for me to help edit content?,I recommend starting [POLICY] so that you can learn about how to edit.,13,13,Info boba,Voorts
10,2,c10_p2,B,low,0,26516,1.1839,0.5825,"Hello, thank you for being my mentor. Please how do I edit and correct a post here?","Moschinoy2k9 Hello and welcome to Wikipedia. If you meant to ask [POLICY], you just made an edit by editing this talk page! I'll send you some links on to help you get started. Cheers! '",17,34,Moschinoy2k9,Relativity
10,3,c10_p3,A,high,1,26830,1.4649,0.563,Hello! I'm Secton. What things should I edit for probably?,"Hello @! If you want, you can look at which gives you a few ideas of articles you can look at!",10,21,Starrysecton,Chaotic Enby
10,3,c10_p3,B,low,0,25676,1.4649,0.563,"hello. I'm PROVIDENCE, new on this platform. I would like to take my first step on editing.","Hi @, welcome to wikipedia! should have some automated suggestions for you, and I've left a welcome message on your talk page. I'm guessing from your name that you're from East Africa. Our coverage of the area in general is pretty poor, so you'll probably be able to find a lot of articles on local topics that are outdated or need expansion, if you're interested in writing new content about that.",17,71,IRADUKUNDA Providence,Asilvering
10,4,c10_p4,A,high,1,32723,1.754,0.5344,What should I post or edit first?,Can you clarify what you mean? Happy editing.,7,8,Naslmah,Dafootballguy
10,4,c10_p4,B,low,0,40747,1.754,0.5344,"Hey, I'm a beginner in editing,is there a way you can provide help for beginners like me?","Yes - if you have any questions about editing Wikipedia, you can ask me here and I'll try my best to answer. You can also ask questions at the [POLICY].",17,30,Nhlanhla sello,Sungodtemple
11,0,c11_p0,A,high,1,953,0.305,0.7522,How do i make a new wiki article,Hello . Check out [HELP_PAGE] and [POLICY]. Have a nice day :).,8,10,Callum0777,Qcne
11,0,c11_p0,B,low,0,28058,0.305,0.7522,How can I create my own article on something that's not available on wikipedia?,"Hello -- starting an article is usually considered one of the more difficult tasks; most people start off by making edits to articles that already exist. When you do want to write an article from scratch, the place to go is [POLICY]. There is a very useful guide at [HELP_PAGE]. ·",14,50,58ashutosh,UndercoverClassicist
11,1,c11_p1,A,high,1,14088,0.6865,0.7539,Suggest steps so I can start writing articles that get published on wiki,"YouthChangemake Good day and thank you for the question. To have an article in Wikipedia, the subject needs to pass [POLICY] guidelines. To meet the GNG guidelines, he subject of the article needs to have [POLICY] from [POLICY], [POLICY] such as from the major newspapers and books where by the sources talk about the subject in length and in dept and not passing mention for [POLICY]. All social sites, including utube, X, any sources that are related/affiliated/associated with the subject are considered either not independent or reliable. Pls read [POLICY] for further details. I suggest you to complete [POLICY], a 90 mins program, so you could understand some of the Wikipedia guidelines for editing. Let me know if you have further questions as I am here to help. Stay safe and best.",13,132,YouthChangemaker,Cassiopeia
11,1,c11_p1,B,low,0,22508,0.6865,0.7539,Hello Id like to make a Wikipedia page or article? How do I start,"Note that creating new articles is not beginner friendly, so I really recommend you start with simpler edits, such as those suggested at , and work from there. If you really want to continue, try taking a look at [POLICY] - it's the most beginner friendly guide to creating new articles.",14,50,OfficialMonicaSan,Sungodtemple
11,2,c11_p2,A,high,1,38777,0.727,0.6315,hello sir as i am new to wikipedia can you tell me how to add an article,"Hi @, [HELP_PAGE] is a comprehensive guide to creating new articles. However, I would recommend gaining some more experience by working on easier tasks first, like the ones at the [POLICY] or the structured tasks on .",17,36,Kashmirvalley777,Liu1126
11,2,c11_p2,B,low,0,34238,0.727,0.6315,I want to start a write-up on Wikipedia,"Hi there! Do you mean you wish to create a new article? If so, please take a look at [POLICY], as well as the [POLICY] and the [POLICY] to get you started. Thanks, ( • )",8,33,MPE BEST25,~delta
11,3,c11_p3,A,high,1,13815,0.9184,0.7107,Hello I’m new to Wikipedia what are the steps I can take to start editing and how long before I can start creating my articles thanks,"@: Hey there—welcome to Wikipedia! You can read through [HELP_PAGE], our getting started page, for a nice introduction to editing as a whole. Let me know if you have any questions or concerns, and happy editing!",26,36,Ntekops,Bsoyka
11,3,c11_p3,B,low,0,18980,0.9184,0.7107,I want to start writing in Wikipedia,"That would be why I deleted the request, which I'd typed out but accidentally sent too early (before the end of the conversation, where people suggested starting with templates first).",7,30,Afghanistan and the world,Closed Limelike Curves
11,4,c11_p4,A,high,1,20649,1.0676,0.696,How To create a Wikipedia article,Hello SharmaJiKaChotaLadka and welcome to my user talk page. I left a welcome message on your talk page that should offer some useful links. If you have any questions after reviewing that information please do come back and ask for assistance. Happy editing!!,6,42,SharmaJiKaChotaLadka,ARoseWolf
11,4,c11_p4,B,low,0,25352,1.0676,0.696,"Hi, I want to write an article on wikipedia. But didn't find a button to write new article.","Hello, Waqar Azeem0, and welcome! You can't create an article directly, but you can create a [HELP_PAGE]. However, I wouldn't recommend it. Creating an article on Wikipedia is pretty complicated, because the subject has to be [POLICY], [POLICY], and based basically entirely on what [POLICY] say. [POLICY] explains more about the requirements for a new article. Newcomers usually have a better experience, though, editing existing articles (see the [POLICY] for ideas) to get familiar with Wikipedia and its guidelines. Let me know if you have any other questions, and happy editing ~",18,89,Waqar Azeem0,Perfect4th
12,0,c12_p0,A,high,1,25435,1.4649,0.6864,"Hello!! I'm pretty new to this, but I just wanted to ask if you have any tips or tricks for editing pages. Thanks.","Hello, BombshellCarousel Sorry for the delay, I've had a busy weekend. The answer really depends on what you want to edit. Generally, you can check out [HELP_PAGE] for basic editing how-tos and info, and for general guidelines. There's also a couple of tutorials you can use ([HELP_PAGE] and [HELP_PAGE]). There's so many things you could do, so if you have questions about something specific let me know and I'll try to help out with more tips for that! I'll also put a welcome on with more links. Happy editing!",23,88,BombshellCarousel,Perfect4th
12,0,c12_p0,B,low,0,25239,1.4649,0.6864,how do i edit pages,"@, just press edit, don't be afraid to [POLICY]. If you want to test use [POLICY]. (they/them)",5,16,Lexaboee123,Zippybonzo
12,1,c12_p1,A,high,1,2926,1.543,0.8872,How do I edit a page,"@, which one?",6,3,Prawlnic,Alaexis
12,1,c12_p1,B,low,0,630,1.543,0.8872,Hello! how to edit the page?,@: on you mobile device you can visit an article and click the pencil icon to edit a page. [HELP_PAGE] may help.,6,22,Gulapa Sathish,Commander Keane
12,2,c12_p2,A,high,1,34287,2.5193,0.7634,how do I edit a page,"Hi there! In order to edit a page, you can click the ""edit source"" tab on the upper right corner of the page and change the Wikipedia article text to what you need to change it to. Also, please feel free to take a look at our [POLICY] as well as our [HELP_PAGE], [POLICY], [POLICY] and [POLICY]. Again, welcome and happy editing! Thanks, ( • )",6,63,Muhaideen Faiz Brichini,~delta
12,2,c12_p2,B,low,0,34098,2.5193,0.7634,What should I know about creating and editing pages?,"@: [HELP_PAGE], our introduction page, has what you need to know!",9,11,Tjpwheelie,Rusty Cat
12,3,c12_p3,A,high,1,6704,2.838,0.8567,"hi, how might i go about editing a page?","@: Hi there! By asking this question, you've edited a page! I suggest starting at [HELP_PAGE] to learn more about editing with Wikipedia. Happy editing!",9,25,Enzobenenz0,GoingBatty
12,3,c12_p3,B,low,0,25239,2.838,0.8567,how do i edit pages,"@, just press edit, don't be afraid to [POLICY]. If you want to test use [POLICY]. (they/them)",5,16,Lexaboee123,Zippybonzo
12,4,c12_p4,A,high,1,33926,2.9051,0.7202,"Hi, I am here to learn how to make edits and create pages.",@: Hello and welcome to Wikipedia! Is there anything you'd like help with? ~ ~,13,13,PyTechGenius,Rusty Cat
12,4,c12_p4,B,low,0,26833,2.9051,0.7202,"Hello. So, could I just go to a page and edit it if I want to?","Hello @! Yes, you can – [POLICY]! Although, if you want to be a bit more prepared, I've written [POLICY] to help new users with the basics of editing!",16,29,Avery Ando,Chaotic Enby
13,0,c13_p0,A,high,1,20883,0.534,0.2347,"Hi Halley!
Thank you for the warm introduction. I'm new here and still learning. My name is Reki Fadhullah A.K.A Abu Khabr. My English is not perfect, but I’m eager to improve and contribute.
I really appreciate your support and guidance. Nice to meet you!","Hi @, It's my pleasure to be your mentor . You can read [HELP_PAGE] if you are a new one. If you need any further assistance, please leave a message on this talk page and I'll try to help you to the best of my knowledge. Best regards! [WIKILINK]",45,48,Reki Fadhullah AKA Abu Khabr,Sunny Cryolite
13,0,c13_p0,B,low,0,11628,0.534,0.2347,Im brand new to this can I get jus a rough idea of the process and tools im gonna need to get familiar with,See [POLICY] for a good guide to Wikipedia for new editors. Let me know if you have any questions.,24,19,BigSeven777,Gommeh
13,1,c13_p1,A,high,1,462,0.9184,0.3808,"Hi - just getting started and looking forward to contributing to this global public good. best, david","Hello DBlazes; i apologise for not replying sooner; i have been off Wikipedia for a couple of months and not terribly active for a few prior to that. If you still require assistance, please feel free to start another section at the bottom of this (my) talk page, and i will do what i can to help ~",17,56,DBlazes,LindsayH
13,1,c13_p1,B,low,0,9712,0.9184,0.3808,"Hey there ,
I'm new here , so please give me some instruction.","Sure, what do you need help with? '",11,8,-safowanriyadx1,MWFwiki
13,2,c13_p2,A,high,1,36584,1.7877,0.373,"Hi there!
Ummm....... I have no idea how to do this!!!!
Can you help me out bro! Thanks man!!!!!😀😀","@ Happy to help! What are you looking to do, and do you have something in mind you want to work on, or are you looking for things around Wikipedia to help with?",19,33,Tulip1412,Aplucas0703
13,2,c13_p2,B,low,0,40693,1.7877,0.373,"I love this it keeps my brain working better how do I know what's true and what's not true? I know that sounds unusual but I was trained by MIT to spot or try to spot fake data and images.
Thank you very much for being there to help me I'm grateful","Hi @, welcome to Wikipedia and thanks for reaching out!
I’m here to help with any questions you have as you get started exploring Wikipedia, so please let me know if you need a hand!",52,35,Olviashowers,SnowyRiver28
13,3,c13_p3,A,high,1,37999,1.8611,0.3864,"Ify,
Thank you for offering support. I am really new to this and it's great to have to learn from you. What would be some mistakes not to make as a starter.","Welcome! If you haven't already, take a look through [HELP_PAGE] for a beginner's guide to editing Wikipedia. Feel free to use the mentoring feature to ask me any questions you have about Wikipedia, or you can ask as the [POLICY].",32,40,Klassbond,Iffy
