cluster,pair_rank,pair_id,role,retention,outcome,cid,mentee_dist,emb_cosine_sim,question_text,reply_text,question_words,reply_words,mentee_name,mentor_name
13,3,c13_p3,B,low,0,36546,1.8611,0.3864,"Good Afternoon, I’d love your help in how all of this works. Is this something you can help with?","Hello FiguringThingsOut! Welcome to Wikipedia, and thanks for reaching out. I'm happy to help you understand how everything works. You've come to the right place.
Think of Wikipedia as a massive collaborative project. Unlike a traditional encyclopedia written by a small team of experts, Wikipedia is built by volunteers like you and me. Our goal is to compile the sum of all human knowledge, and we do it by working together, following a few core principles.
Here’s a quick breakdown of how it all fits together:
1. The Five Pillars (Our Constitution)
Everything we do is built on five fundamental principles. You don't need to memorize them, but it's good to know they exist:
Wikipedia is an encyclopedia: It’s not a soapbox, a blog, or a place for advertising.
Neutral point of view (NPOV): Articles are written fairly, without bias, representing all significant viewpoints on a topic.
Free content: Everything is freely licensed, meaning anyone can share or reuse it.
Civility and respect: We collaborate by discussing disagreements and assuming good faith.
No firm rules: Don’t worry about making mistakes. The rules are flexible, and we focus on improving the encyclopedia.
2. How Articles Are Created
You can't just write an article about anything you want from scratch right away. Wikipedia requires ""notability"" —meaning the topic has received significant coverage in reliable, independent sources (like major newspapers, books, or academic journals).
New editors usually start by making small edits to existing articles: fixing typos, adding a citation, or rephrasing a sentence for clarity. This helps you learn the ropes before tackling bigger projects.
3. The Editing Interface
There are two main ways to edit:
Visual Editor: This is the default for most new users. It works like Microsoft Word—you see the page, click ""edit,"" and make changes directly.
Source Editor: This shows the underlying code (wikitext). It’s more powerful once you get used to it, but Visual Editor is a great place to start.
4. The Community (It’s Not a Lonely Process)
Wikipedia is a community. Every article has a ""Talk"" page (look for the tab next to the article) where editors discuss changes. If you have a question, you can ask:
Here on your mentee page (I’ll watch it and reply).
The Teahouse: A friendly Q&A forum specifically for new editors. You can find it at [POLICY].
Help desks: There are help pages for almost everything.
5. What Makes a Good Edit?
A good edit is one that:
Adds verifiable information (with a citation to a reliable source).
Is written in a neutral tone (no opinions, no marketing language).
Improves the encyclopedia, even if just by fixing a typo.
Where to Start?
If you're ready to jump in, here’s what I recommend:
# Create a User Page: Click on your username (at the top right, in red) and write a sentence or two about yourself. It’s a great way to say ""I’m here!""
# Try a ""Quick Fix"": Look for articles about topics you already know well. Is there a missing fact? A typo? Try making a small edit. Use the ""Show preview"" button before saving to check your work.
# Use the Citation Tool: When you’re in Visual Editor, click ""Cite"" in the toolbar. You can paste a URL, and Wikipedia will often generate the citation for you automatically.
# Don’t Worry About Perfection: Every edit is saved in the page history. If you make a mistake, another editor (or you!) can revert it. It’s all part of the process.
Useful links for getting started:
[POLICY] – The core principles of Wikipedia
[POLICY] – How to write without bias
[POLICY] – Why reliable sources matter
[HELP_PAGE] – A guide to the easy editing mode
[HELP_PAGE] – If you want to learn the source code
[POLICY] – A step‑by‑step interactive tutorial (works for anyone)
[POLICY] – A friendly Q&A space for new editors
[POLICY] – For general help questions
[POLICY] – A hub for finding tasks and projects
[POLICY] – A classic introduction to editing",19,665,FiguringThingsOut,Alvinategyeka
13,4,c13_p4,A,high,1,2105,2.0962,0.3263,hi. does it look good,?,5,1,Saria116,Mujinga
13,4,c13_p4,B,low,0,5666,2.0962,0.3263,do you think i can be of any use as an highchooler ?,"@ Of course, [HELP_PAGE] is a great guide to getting started here on Wikipedia, take a look at it and if you have any further questions I'll be happy to answer them.",12,32,Jaiswarup,Jeffrey R. Clark
14,0,c14_p0,A,high,1,24199,0.534,0.7388,How can I make a Wikipedia page?,"@ Hello, and thank you for your interest in editing Wikipedia!
That is a great question. I would recommend you to read [HELP_PAGE]. While a new article does not have to be perfect, one of the best methods of creating a good article is to find two or three independent sources that covers the topic. These sources should not be related to the source in any way. After that, it would be good to see how similar articles are structured and use them as a template. And lastly, ensure that your text makes sense and does not have any typos. You can create a draft page at [DRAFT], and once you are satisfied, you can submit it to [POLICY] for review (and hopefully it becoming an article!",7,127,Ajacen- -,GGOTCC
14,0,c14_p0,B,low,0,16168,0.534,0.7388,Hi how do I add new info on Wikipedia,"To add a new info to an already existing Wikipedia page, click on the edit (visual editor) at the top of the paragraph where you want to add information, put your cursor where you want to add information and type the text you want to add and publish changes.
To add a reference, put the cursor where you want to place the reference and click on cite, choose automatic and add paste the link you want to use as the reference. Then click create, click insert and publish changes.",9,89,Black The Keed,Kinvidia
14,1,c14_p1,A,high,1,31896,0.534,0.8257,"Hi. I wanted to know, how can you make a Wikipedia page? I'm new.",I've left a message on your talk page. The introduction and tutorial are a great place to start. Hope this helps! | ([LINK]),14,23,UWU. Lava,CREditzWiki
14,1,c14_p1,B,low,0,14740,0.534,0.8257,"Hey , Can you tell me how to create a wikipedia Page",:Please see [POLICY],11,3,Asadhamid8,Kingsif
14,2,c14_p2,A,high,1,33866,0.5957,0.849,How do I make a Wikipedia page,"Hi @! I'd advise looking over [POLICY]. It gives you an overview of the process, a ton of links, and a step-by-step guide. Good luck! ( · )",7,25,Mombo676767,Phoenix
14,2,c14_p2,B,low,0,24681,0.5957,0.849,how would I write a wikipedia page ?,"please read this instruction : [HELP_PAGE], thanks",7,6,MansaMusa444,Endrabcwizart
14,3,c14_p3,A,high,1,38323,0.7356,1.0,Hello there. I want ask: How does making something/someone wikipedia page works?,"Hi and welcome to Wikipedia, ! If you want to create a new article about someone or something, consider reading our [POLICY]. But before you attempt at creating a new article, I recommend you get used to editing on Wikipedia by doing small changes to existing articles. Please see our [POLICY]. If you have any more questions, feel free to ask me or at the [POLICY].",12,65,EhWellUmm971,Isabelle Belato
14,3,c14_p3,B,low,0,33158,0.7356,1.0,Hello there. I want ask: How does making something/someone wikipedia page works?,"Hi and welcome to Wikipedia, ! If you want to create a new article about someone or something, consider reading our [POLICY]. But before you attempt at creating a new article, I recommend you get used to editing on Wikipedia by doing small changes to existing articles. Please see our [POLICY]. If you have any more questions, feel free to ask me or at the [POLICY].",12,65,Alcheter,Isabelle Belato
14,4,c14_p4,A,high,1,23850,1.0485,0.7027,"Hey there, Can you guide me on how to start a new page on Wikipedia?","Hi, you could take a look at [POLICY].",15,8,Iamlionofthejungle,Barnards.tar.gz
14,4,c14_p4,B,low,0,17784,1.0485,0.7027,how can I make my own Wikipedia page? If you do not know that is fine. Have a great day!,"Hi @ thanks for wanting to contribute to Wikipedia. However, it is a definite [POLICY] for users to write their own articles, so my advice is ...don't! What you could do is put a [POLICY] and see if another editor is interested?",20,41,PapaMeelo,Lajmmoore
15,0,c15_p0,A,high,1,2482,1.6087,0.5038,"How did you become a mentor? Do you have a mentor? I'm very interesting in contributing to the largest bank of free information in the world. Is there a rank above mentor? Thanks, and I look forward to your response!","@ The mentorship module is a new functionality introduced just a couple of years back. As a preview to its capabilities, everyone was assigned a mentor be it new or old editor. There is no 'rank' among editors, however some editors may be entrusted by the community with additional user rights to help out with the administrative matters. Being a mentor is just simply to help newcomers in their editing journey. If you have issues with editing, you can ask your question here or at [POLICY] where there are likeminded editors assisting newcomers where possible.",40,95,Chubbychucker,Robertsky
15,0,c15_p0,B,low,0,10494,1.6087,0.5038,hello can i by any chance be mentored,"Hi FAITH FG, I am here to be your mentor if you need one. What questions do you have about editing the encyclopedia so far?",8,23,FAITH FG,Fritzmann2002
15,1,c15_p1,A,high,1,30291,2.5879,0.5292,"Yo, they put you as my mentor so uh, what do you recommend on getting started?","Good question, I find the [POLICY] page really helpful when I can't find what to do.",16,16,MrMirck,Lordseriouspig
15,1,c15_p1,B,low,0,29242,2.5879,0.5292,"hello my mentor can you help me improve my editing skills better thanks.
your mentee Bamba jaiteh","@, you can view [HELP_PAGE] to learn more about editing, including improving your own editing skills.",17,16,Bamba ML Jaiteh,ToadetteEdit
15,2,c15_p2,A,high,1,27441,2.8295,0.3755,"Hey,
I had no idea that mentoring was a thing! Do you have any guidance on how to go about making changes without being disruptive? How do you decide whether or not a change is large enough to warrant a discussion on the talk page?","Neofih Welcome to Wikipedia. In general, you should [POLICY] and just make the change! If someone reverts you, follow the [POLICY] and discuss it with them on the talk page. If you have any questions please lmk —' [TEMPLATE_REF] mewhen u reply ( - )",45,44,Neofih,Matrix
15,2,c15_p2,B,low,0,26348,2.8295,0.3755,"Hi Mentor! As it happens, I'm an Australian-American whose family hails from Melbourne. It feels like I was meant to join. Any places you would suggest a newcomer start with editing?","Hi @ and welcome to Wikipedia! There's a lot of different ways to contribute, I recommend starting small. If there's a topic you're interested in, you might go through those and see if any articles need improving with grammar/spelling/tone. There's some good resources at [HELP_PAGE] and there's also [POLICY] to guide new editors. If you've ever got questions feel free to ask me!",31,63,LordHothofDolAmroth1995,Ultraodan
15,3,c15_p3,A,high,1,6145,3.1023,0.5538,"Hi Mentor,
It's an amazing community here. When creating a topic, what are the things to have in mind? I also want to know why some wikipedia articles get deleted overtime.","The most important feature that allows an article to be kept is that [POLICY] is convincingly established, and there is a reasonable amount of verifiable content cited to reliable sources. Also of critical importance is that the content does not contravene copyright laws and rules. Cheers, :",31,46,Distrigency,Pbsouthwood
15,3,c15_p3,B,low,0,31252,3.1023,0.5538,"Hello can I call you simply mentor? I was wondering if you could teach me how to create an article?
thx =)","Hello! You can call me whatever you want. Onto your request, I usually tell mentees to first read this guide [POLICY], and if they have questions, to come back here and ask. If you need me to explain something in the guide, I'd be happy to.",22,46,PuppycornToonz,MuffinHunter0
15,4,c15_p4,A,high,1,3453,3.5162,0.4817,"dear Mentor, Im happy to have you around for the help! what is the first thing I should look into editing a wiki page? Thanks.","Hi, Mousans, if you are editing an existing page, you should understand that there are two editing tools you can use, the [HELP_PAGE], and the [POLICY] (also known as the Wikitext Editor. Most people find the Visual Editor easier to learn, but I prefer to use the Source Editor. You can try both of them out, making test edits in to see how they work.
The next thing, is to understand that everything you add to a Wikipedia article must be [POLICY]—you cannot add your own ideas, opinions, or even your certain knowledge; everything must be backed up by [POLICY], such as books, academic journals, reputable magazines, and certain websites with a reputation for fact-checking, peer-review, neutrality, and reliability.
Do you have a specific article in mind that you would like to edit?",25,132,Mousans,Mathglot
15,4,c15_p4,B,low,0,31617,3.5162,0.4817,"Hello
What is a mentor and what does that help
Is it for socializing with people ? I don't get it
Thank you","Hi @: I'm here to help you with editing Wikipedia. Let me know if you have any questions on that. Cheers,",22,21,Rjman19,SunloungerFrog
16,0,c16_p0,A,high,1,10543,0.5117,0.6345,"Hi! How do i make a new page? By the way, can I call you mentor, or something else?","Hello RetroGenesis, welcome to Wikipedia! I like your username a lot, by the way! To start working on a new page, see [HELP_PAGE]. It will walk you through the process, but if you run into problems feel free to drop me another message and I can work through it with you.",19,50,RetroGenesis,Fritzmann2002
16,0,c16_p0,B,low,0,14707,0.5117,0.6345,How can you make a page about a topic,"You'd have to research and write it yourself, following the [POLICY] of Wikipedia. Once you're familiar with how articles are written, and have your [POLICY] on hand, you can create a draft at [POLICY].",9,34,Jose011414,Kingsif
16,1,c16_p1,A,high,1,29969,0.6865,0.8805,How do I make a page?,"Hey @, I noticed IntentionallyDense seems to be taking a wikibreak right now. Instead, I'll answer your question. You'll want to read [HELP_PAGE], which links around halfway down to the [POLICY].
ok
#Math",6,32,SerialDesignationF,IntentionallyDense
16,1,c16_p1,B,low,0,30682,0.6865,0.8805,Hi! How do i make a new page?,"Hello, @. To create a page, using [POLICY] and [POLICY]. For the drafts, see [POLICY] to start drafting an article. Thank you. • [WIKILINK]",8,24,Thecoolestjenny,KuyaMoHirowo
16,2,c16_p2,A,high,1,16471,1.6732,0.8574,hello how to make a page,"Hi , welcome to Wikipedia!
Creating an article from scratch is very difficult, and it may be a frustrating experience because you need to be familiar with a lot of different policies & guidelines on how to write appropriate content for Wikipedia. It‘s not usually recommended for new editors, but it‘s entirely allowed. [POLICY] provides guidance for new users on writing an article, including some of the more technical aspects. I suggest you read through that, as well as some of the policies it links to. I‘d be happy to help you with any questions.
There is a basic requirement for standalone article topics called [POLICY]. In most cases, that means that independent and reliable sources need to have published significant content on the subject.
Something else to be aware of is that it's generally not a good idea to create articles about yourself, your family or friends, or a company or organization that you work for or with. That's mainly because it's extremely difficult to write from a [POLICY] in such cases. You can read more about conflicts of interest [POLICY].
I know it can be discouraging to have all these guidelines thrown at you, but please don‘t let it dissuade you from editing here on Wikipedia. Meanwhile, it may be good to go around and improve existing articles to learn the ropes. If you see something wrong, don‘t worry too much about knowing all the guidelines; be [POLICY] and fix it! Happy editing! :) ,",6,244,Catlover1519,Actualcpscm
16,2,c16_p2,B,low,0,27508,1.6732,0.8574,"How do I make a new ""page""","@:
Hi, since you are not [POLICY] yet (10 edits, 4 days of experience) you can not create articles directly. However, you can create a [POLICY] an submit it for review. Just go to [POLICY] and follow the instructions there. You may want to read [HELP_PAGE] before you start. Feel free to message me if you have any questions! Ping me!",7,61,TheRealJang,ARandomName123
16,3,c16_p3,A,high,1,8192,3.8628,0.781,hello can how do i make my own page,"Hello! Please check out our [POLICY]. In summary, you should not make a page for your own business. —",9,18,Tourist bus simulator,Ganesha811
16,3,c16_p3,B,low,0,40633,3.8628,0.781,How do I make a new page,"How can I get to know more, like give me some summary
Cozzy bee I left you a welcome message on your talk page, you can learn more about this site by reading the links.",7,35,Lars Fene,Shellwood
16,4,c16_p4,A,high,1,24179,4.0106,0.6515,How do i consistently create new pages of high quality.,"Hello, and thank you for your interest in editing Wikipedia!
That is a great question. I would recommend you to read [HELP_PAGE]. While a new article does not have to be perfect, one of the best methods of creating a good article is to find two or three independent sources that covers the topic. These sources should not be related to the source in any way. After that, it would be good to see how similar articles are structured and use them as a template. And lastly, ensure that your text makes sense and does not have any typos.
:Does this make sense?",10,102,A.Kefas,GGOTCC
16,4,c16_p4,B,low,0,16783,4.0106,0.6515,How do I make a page?,"Hi, have a look at [POLICY] page.",6,7,MinarchistGuy381,Pickersgill-Cunliffe
17,0,c17_p0,A,high,1,17563,0.7965,0.5582,"Hello
Please help me to start editing",Hello @. Thank you for reaching out. I've left some notes on your [TALK_PAGE]. Hope you find it useful. Cheers,7,20,Khadiyam,Robertjamal12
17,0,c17_p0,B,low,0,25994,0.7965,0.5582,How and where to I type in changes......?,"Hi @, welcome to Wikipedia! I've left a message on your talk page with a lot of helpful links. Feel free to come back and ask any further questions if those don't sort you out.",8,35,Les47griffy,Asilvering
17,1,c17_p1,A,high,1,968,0.9491,0.6637,where should I edit first?,"That's a very broad question, @. What are you interested in? Have you checked out which gives you suggested edits at various levels of difficulty? '",5,26,Areux,Qcne
17,1,c17_p1,B,low,0,28459,0.9491,0.6637,How do I edit stuff?,@ [HELP_PAGE] =D,5,3,Learningiscool13,LuniZunie
17,2,c17_p2,A,high,1,21929,1.2919,0.7157,"Hi, Can you please guide me how to edit.",LVSDubai Welcome to Wikipedia. I've left you a message with a few links on your talk page. Take a look at them when you have the chance. I suggest that you start with [POLICY]. Happy editing!,9,35,LVSDubai,MPGuy2824
17,2,c17_p2,B,low,0,32465,1.2919,0.7157,How do i start editing,Lekhawiki Welcome to Wikipedia! I've left some links on . You may wish to check out [HELP_PAGE] and [POLICY]. Let me know if you have any questions. Happy editing!,5,27,Lekhawiki,CFA
17,3,c17_p3,A,high,1,20478,1.5427,0.7136,I cannot find things to edit.,"Hello MagmaAdmiral. What kinds of things are you interested in? There's a list [POLICY] of pages that could particularly use some help, but another option is to just find an article that interests you, read it, and think about ways it could be improved.",6,43,MagmaAdmiral,Extraordinary Writ
17,3,c17_p3,B,low,0,18988,1.5427,0.7136,hello how do i even edit smth in the first place,See [HELP_PAGE].,11,2,Mehenteepicismm,Closed Limelike Curves
17,4,c17_p4,A,high,1,19272,1.6019,0.6603,"Hello 👋, would you give me a little bit of guidance on ""how to edit things around"", thank you.",I sent a welcome message to your [TALK_PAGE].,19,8,AmonRa6633,Dege31
17,4,c17_p4,B,low,0,34428,1.6019,0.6603,Hello I want to edit,"@: If you want to edit a page, just click the edit button! Do you have any questions about editing Wikipedia? ~ ~",5,21,Taelo Moletsane,Rusty Cat
18,0,c18_p0,A,high,1,20872,3.4228,0.5167,How do i start contributing?,"Hi @, you can read [HELP_PAGE] to better understand what you can do at Wikipedia. Have a great day! Best regards. [WIKILINK]
Yeah sure appreciate it, thanks Như Gây!",5,29,Rizal Nagagini,Sunny Cryolite
18,0,c18_p0,B,low,0,1043,3.4228,0.5167,Hoy I can start me page,Can you clarify your question? Are you asking about making your [POLICY] or an article?,6,15,J.jase200,Whpq
18,1,c18_p1,A,high,1,39504,8.1185,0.5332,"Hi Oshwah, any tips for starting out will be greatly appreciated.","Ivar Penn I've left some helpful links on your talk, Welcome,",10,9,Ivar Penn,Oshwah
18,1,c18_p1,B,low,0,28709,8.1185,0.5332,How do o start,"has a really good guide and suggestions for you, try visiting it! Feel free to ask questions if you need help with a specific thing (click the ""Special:Homepage"")",4,28,Eneojonugwa,AlphaBetaGamma
18,2,c18_p2,A,high,1,38455,10.9492,0.6007,How do i start making changes,"Hello! Welcome to Wikipedia. I see someone has already left some useful links on — you can read through those, or you can start at [HELP_PAGE]. Hope that helps!",6,29,BlueCats21,JustARandomSquid
18,2,c18_p2,B,low,0,24234,10.9492,0.6007,Where do I start,"Hello, and welcome! With such a broad question, I am unsure what advice to give you. Have you read [HELP_PAGE] and [POLICY]? These pages serve as an introduction to various parts of Wikipedia. Feel free to ask if there is anything you want clarified?",4,44,Roleyroll,GGOTCC
19,0,c19_p0,A,high,1,11513,0.305,0.4586,"Hi Aaron,
I'm a retired sustainability analyst with the Candian government. I'm generallyinterested in how sustainability and natural resource management can coexist in areas like mining, forestry and energy. Do you have any tips on how to contribute to Wikipedia?
Thanks
Ben",I've sent you a welcome template with some pointers! also suggests some tasks for a topic of your choice.,42,19,Bdavid1985,Aaron Liu
19,0,c19_p0,B,low,0,26337,0.305,0.4586,"Hello I am new to Wikipedia and would like to contribute to this platform, could you help me on where to start. Thank you.",Hi @ and welcome to Wikipedia! There's a lot of ways to contribute. Someone has already posted a message on your talk page with some useful links. I recommend starting by looking at [HELP_PAGE].,24,34,Adistar1516A,Ultraodan
19,1,c19_p1,A,high,1,38654,0.3051,0.6019,"Dear Lectonar
I hope you are well, I have just started Wikipedia and
would like to contribute by editing articles what are some you
would recommend or I should look out for?
best wishes
Analyst90!",I have left a welcome with some links on your talk-page.,33,11,Analyst90,Lectonar
19,1,c19_p1,B,low,0,32653,0.3051,0.6019,"Thank you for providing help to Wikipedia participants as a mentor. For a newcomer, what types of edits would be good early-stage contributions to the ecosystem?","For basic tasks that include cleaning up grammar and expanding articles, please see [POLICY]. ~~",26,14,Improveditor,PolishHamster
19,2,c19_p2,A,high,1,23403,0.534,0.6082,"Hello, How do I edit or create articles, and how do I add photos, citations, references, etc, etc. The only reason I am asking you this is vecause I want to gelp wikapedia to help others.","Hiya @, welcome to Wikipedia. I would usually recommend starting with [HELP_PAGE]. There are usually help pages associated with what you are asking. I would recommend starting with [HELP_PAGE] and [HELP_PAGE]. Feel free to ask me about the specifics if needed.",36,41,"Eamonn A, Lalor",Justiyaya
19,2,c19_p2,B,low,0,15291,0.534,0.6082,"Hello!!! I am new here and I want to add to different pages of Wikipedia sites. Is there anything I can suggest or help any pages? Im new but please just give me a chance ok? ^_^
waddle","Mr duckkwaddling Hi, welcome! There is a general guide to editing [HELP_PAGE], and a list of tasks categorized by editing expertise required is available [POLICY]. Let me know if you have any other questions or run into any issues! '",38,38,Mr duckkwaddling,AviationFreak
19,3,c19_p3,A,high,1,16233,0.534,0.585,"Hello I am new to wiki so I would like your advice
I want to edit a page but it is locked
So I am thinking about creating new page
How should I do that","Hi Insane miner. If you wish to edit a specific page but you can't, it's probably [POLICY]. Instead of creating a new duplicate page (unless you were trying to write about something else?), you should make an [POLICY] on the talk page you wish to edit. Let me know if you have any further questions.",35,53,Insane miner,Clovermoss
19,3,c19_p3,B,low,0,28583,0.534,0.585,Hey! I'm a person who is aspiring to be a newseditor so any tips as it is my first time editing wikipedia?,"Hello, have you considered joining Wikinews instead? Wikipedia is [POLICY]...",22,10,Thechiceditor12,AlphaBetaGamma
19,4,c19_p4,A,high,1,30475,0.6101,0.4665,"Hello Reconrabbit. I hope you are well. I would like to ask your advice on contributing to Wikipedia. I am a university student working on my honours in Classics, so I have a fairly sound command of academic English and research, but I do not feel qualified to write my own articles at present. On what do you suggest I focus my attention as an editor?","Hello PantaRheiClerk. Wikipedia has many open tasks to work on. What are you interested in? There are Wikiprojects that cater to every topic, and each one has its own [LINK].",65,29,PantaRheiClerk,Reconrabbit
