cluster,pair_rank,pair_id,role,retention,outcome,cid,mentee_dist,emb_cosine_sim,question_text,reply_text,question_words,reply_words,mentee_name,mentor_name
19,1,c19_p1,B,low,0,14261,0.3027,0.3363,Bonsoir j'espère que vous vous portez bien ? Puis-je savoir comment faire une biographie ?,"OLLOMO ABAGA Nathaniel Good day.
In order for a subject to warrant a page in the main space of Wikipedia, it must fulfill the criteria outlined in the Wikipedia guideline on notability, specifically the General Notability Guideline ([POLICY]). Since this is English Wikipedia, the content of the article needs to be in English.
GNG is defined as the subject must fulfill specific criteria to demonstrate [POLICY] from [POLICY] and [POLICY] sources. These sources should provide in-depth discussions about the subject rather than merely offering passing mentions. This requirement is essential for verification, which is a core policy of Wikipedia. If a source is affiliated/associated/connected with the subject—such as the subject's marketing team, company, social media platforms, information in interviews of the subject or any self-published information—this indicates a lack of independence. Consequently, such sources cannot be utilized to satisfy the notability guidelines. Sources originating from educational institutions, government entities, foundations, social media platforms, and private companies are regarded as unreliable. In contrast, materials published by ""major"" newspapers and ""reputable"" books are typically considered reliable sources.
You can use the ""horizontal format"" of [TEMPLATE_REF] if the source is from the web for inline citation. I recommend that you read [POLICY] and adhere to the provided instructions before beginning the creation of an article. Regards.",13,210,OLLOMO ABAGA Nathaniel,Cassiopeia
19,2,c19_p2,A,high,1,12631,0.4542,0.5579,Hello! How can I edit a biography page about someone I know personally?,"Hello Hannah.keen22, and welcome to Wikipedia! You should start by reading our [POLICY]. The hardest part about writing on Wikipedia about someone you know is that you can only add information to the article if it has been published somewhere that meets [POLICY]-- so there's likely to be a lot you know that has to be left out, to ensure that the encyclopedia is [POLICY]. If you let me know what specific changes you're hoping to make, I may be able to help make them. I'm also happy to answer any other questions you may have.",13,95,Hannah.keen22,LEvalyn
19,2,c19_p2,B,low,0,14261,0.4542,0.5579,Bonsoir j'espère que vous vous portez bien ? Puis-je savoir comment faire une biographie ?,"OLLOMO ABAGA Nathaniel Good day.
In order for a subject to warrant a page in the main space of Wikipedia, it must fulfill the criteria outlined in the Wikipedia guideline on notability, specifically the General Notability Guideline ([POLICY]). Since this is English Wikipedia, the content of the article needs to be in English.
GNG is defined as the subject must fulfill specific criteria to demonstrate [POLICY] from [POLICY] and [POLICY] sources. These sources should provide in-depth discussions about the subject rather than merely offering passing mentions. This requirement is essential for verification, which is a core policy of Wikipedia. If a source is affiliated/associated/connected with the subject—such as the subject's marketing team, company, social media platforms, information in interviews of the subject or any self-published information—this indicates a lack of independence. Consequently, such sources cannot be utilized to satisfy the notability guidelines. Sources originating from educational institutions, government entities, foundations, social media platforms, and private companies are regarded as unreliable. In contrast, materials published by ""major"" newspapers and ""reputable"" books are typically considered reliable sources.
You can use the ""horizontal format"" of [TEMPLATE_REF] if the source is from the web for inline citation. I recommend that you read [POLICY] and adhere to the provided instructions before beginning the creation of an article. Regards.",13,210,OLLOMO ABAGA Nathaniel,Cassiopeia
19,3,c19_p3,A,high,1,32961,0.5077,0.4773,how to create a biography profile,"Hi Dhsenid and welcome to Wikipedia! Creating a new article can be a challenging task, due to all the policies and guidelines one must follow, so I'd recommend you first familiarize yourself with them by helping around in already existing biographies, by doing [POLICY], [POLICY] and so on. If you do still feel like creating an article, you can read [HELP_PAGE], which lays out all the rules you must be aware of.",6,71,Dhsenid,Isabelle Belato
19,3,c19_p3,B,low,0,19961,0.5077,0.4773,Hello. I would like to notify you of a death. You currently have a biography on this person. Please advise. Thank you,"Hey there, Nicky44! I could help you with this task if you specifed who you are referring to specifically. For general advice, replace all present-tense content with past-tense wording, and any information that occured after the death shold be included in the article. For an example of this, see [WIKILINK], who passed away recently.",22,53,Nicky44,Panini!
19,4,c19_p4,A,high,1,27578,0.5078,0.6557,"Hello kind sir, I am facing issues to make the templates for the people I am doing biography of","@: Hi, I see you have made no other edits than this question. Could you please explain what issues you are facing? Ping me!",19,24,Hazhir Mamand,ARandomName123
19,4,c19_p4,B,low,0,25585,0.5078,0.6557,How do I add a biography here,"Hi 24carly, welcome to wikipedia! The short answer is, I'm afraid, that you don't. Please see [POLICY].",7,16,24carly,Asilvering
20,0,c20_p0,A,high,1,25666,0.3027,0.9386,hi,"Hello I AM A VERY PERSONY PERSON|p=, and welcome to Wikipedia! I'll stop by your talk page shortly with some helpful links to help you get started.
ok ty",1,29,I AM A VERY PERSONY PERSON,Asilvering
20,0,c20_p0,B,low,0,5599,0.3027,0.9386,Hi,"@ Hello, and welcome to wikipeida. Is there anything I can help you with?",1,14,Jessica Amanda 2,Jeffrey R. Clark
20,1,c20_p1,A,high,1,1957,0.5096,0.6094,Hi,@ hellos! anything wikipedia-related i can help with?,1,8,Happydayy0023,Mujinga
20,1,c20_p1,B,low,0,38718,0.5096,0.6094,yo,yo yo yo,1,3,Iafckai10,Lfstevens
20,2,c20_p2,A,high,1,21286,0.6487,0.6226,Hi,"Hello , and welcome to wikipedia! let me know if i can help you with anything.",1,15,Migfab,Sakura emad
20,2,c20_p2,B,low,0,40072,0.6487,0.6226,ok,?,1,1,Hannah Myles,Rambley
20,3,c20_p3,A,high,1,32176,0.7034,0.6697,Hii,"Hello @, and welcome to Wikipedia. What is your question? -- [POLICY]",1,12,Fall Out Boyzzz,Pro-anti-air
20,3,c20_p3,B,low,0,27389,0.7034,0.6697,Hi,"Goodsify hey, I noticed you got blocked. Please follow the instructions at to get unblocked. You may want to read [POLICY]. —' [TEMPLATE_REF] mewhen u reply ( - )",1,28,Goodsify,Matrix
20,4,c20_p4,A,high,1,22221,1.0404,1.0,Hi,Hi Let me know if you have any questions about editing Wikipedia.,1,12,Zandisile6,DanCherek
20,4,c20_p4,B,low,0,22222,1.0404,1.0,Hi,Hi Let me know if you have any questions about editing Wikipedia.,1,12,ManishAzadJH,DanCherek
21,0,c21_p0,A,high,1,9508,0.1514,0.5068,"Greetings, Elli. I do not currently have a question, but only wished to introduce myself. I have just created an account and you were assigned as my mentor. I hope you have a wonderful day.",@ hi! I hope you have a wonderful day as well :) Please let me know if you have any questions.,34,20,Fagris Ofnir,Elli
21,0,c21_p0,B,low,0,29041,0.1514,0.5068,"Hello there, I am Maitrey. I want to create a page for Swami Ashok Bharti. An early disciple of Osho who is now spreading the message of love across the world. Kindly guide me to do so. Thank you so much.",@ If you want to create an article you may do so through [POLICY]. However I will note that the person you want to create an article does not seem to be [POLICY]. --,38,33,Swami Ashok Bharti,Seawolf35
21,1,c21_p1,A,high,1,30291,0.1514,0.4432,"Yo, they put you as my mentor so uh, what do you recommend on getting started?","Good question, I find the [POLICY] page really helpful when I can't find what to do.",16,16,MrMirck,Lordseriouspig
21,1,c21_p1,B,low,0,17775,0.1514,0.4432,Hi I am interested in creating a whole new wiki for my guru . He has become quite well known since I first met him 18 years ago please guide if able:) Thank you M,"Wikipedia wouldn't recommend you do that @ as it can be very hard to be unbiassed and neutral (very important parts of editing) if you are close to someone, see [POLICY]",34,31,MirandaFranks,Lajmmoore
21,2,c21_p2,A,high,1,5081,0.2764,0.4687,"i love becca tobin and isobel steele even becky swonke tina Obrien
be my mentor","Hi Billy christopher platt! I like your enthusiasm. Maybe you'd like to start by editing some of those actress articles? You could do some copyediting, or read the cited sources looking for more info, or look for more [POLICY] to add to the articles. Once you get a few edits in, if you'd like me to review your work, let me know. ( / )",15,59,Billy christopher platt,Firefangledfeathers
21,2,c21_p2,B,low,0,5012,0.2764,0.4687,"Hello
My name is Jonathan Acholoh, you've been assigned to me as my mentor","""Hi, Jonathan. Welcome to Wikipedia.",14,5,Ajodoh,GenQuest
21,3,c21_p3,A,high,1,32196,0.3027,0.3796,"Hello, you seem to be my mentor. Can I ask you a question?
I am completely new to this editing and publishing. Where should I start?","Check your talk page i sended some useful links, and start from basic ياش | यशः",26,16,Ziyoda Ortiqxo'jayeva,Orthodox Yash
21,3,c21_p3,B,low,0,18006,0.3027,0.3796,"Hello Vereen, good evening, roses and jasmine You are a mentor to me and I love to learn a lot from you, so I am honored to know you. Thank you, dear Vereen.","Hi Enkidu.AL-Lami, thank you and welcome, please ask me for as much help as you need. For the record, my username is Ferien, not Vereen - I don't mind what you call me, but if you have to find my talkpage outside the mentor dashboard, you won't be able to find me under that username. Kind regards,",33,55,Enkidu.AL-Lami,Ferien
21,4,c21_p4,A,high,1,27652,0.5077,0.593,"Hello ARandom.Thank you for becoming my mentor.How can I help Wikipedia?
Cheers,
PanielDanini=)","@: Hi, thanks for asking! There are a lot of tasks at [POLICY], including adding references, copyediting articles, or fixing links. You can also go to , which should have a suggested edits box, where you can filter by topic and difficulty. Cheers, Ping me!",13,44,PanielDanini,ARandomName123
21,4,c21_p4,B,low,0,30885,0.5077,0.593,"Hello! I am your mentee.
I wish to create a wikipedia page. I think I have gotten the format ready. I'd like your help in getting it published asap because a business kinda depends on it. I'd also love to get your inputs on the writing so there is no loss of quality in my haste.
Thanks a lot","Hello, please see [POLICY]. Also, it looks like you have a [POLICY], which needs to be disclosed. Unfortunately I can not promise that your article can be published because a ""business kinda depends on it"", especially if the article is not supported by reliable sources. Let me know if you have any questions.",59,53,Swaz4Shu,GoldRomean
22,0,c22_p0,A,high,1,16834,0.0,0.3774,Can You Expand For Me Thanks.,"TysWorld Hello, as you haven't asked a specific question I can't help you.",6,12,TysWorld,Pickersgill-Cunliffe
22,0,c22_p0,B,low,0,6363,0.0,0.3774,how do i start ?,"@ Welcome to Wikipedia! I have left a welcome message for you on your talk page. It contains a link to getting started with editing. It’s a huge learning curve at the start - so take it slowly to begin with and practice making small edits to gain a better understanding of how things work here.
Was there something in particular that you wanted to work on? Regards from the UK.",4,71,MykoChan123,Nick Moyes
22,1,c22_p1,A,high,1,1314,0.1514,0.4221,How can I get an administrator?,"If you mean do you want administrator assistance - what specifically do you need help with?
If you mean you want administrator privileges, the easiest answer is to improve Wikipedia consistently over several years, then somebody will probably ask you.",6,40,Danggiakhang18042014,Ritchie333
22,1,c22_p1,B,low,0,31803,0.1514,0.4221,How do I get paid,:Do you mean for editing?,5,5,Santelio,ScrabbleTiles
22,2,c22_p2,A,high,1,3526,0.1514,0.318,hi IV ealready made countless battles but on a temporary account unfortunatly,Hi ! No worries; we're happy that you decided to create an account and join us! Please don't hesitate to let me know if I can answer any questions or assist you with anything. :-) Best,12,34,Historian Felix,Oshwah
22,2,c22_p2,B,low,0,12390,0.1514,0.318,"Yes, Thank you.
Can you please tell me how can I start contributing?","@: Sure, what do you want to write about?",13,9,MikeFlash26,Vermont
22,3,c22_p3,A,high,1,8778,0.1514,0.2974,"Hi bro
Pls help me in this journey","Tagorejcloud, what do you need help with? (Very Busy)",8,8,Tagorejcloud,Yoshi24517
22,3,c22_p3,B,low,0,31017,0.1514,0.2974,"www.google.com.pk
Is Not Update","Hiya, @! Sorry, but I am a volunteer Wikipedia editor and can only help with questions regarding Wikipedia.",4,18,Muhammad Irfanop,GoldRomean
22,4,c22_p4,A,high,1,34329,0.2764,0.3516,hello how much impact have you made?,:Depends on how you measure impacts. I have over 10K edits and several peices of quality content but my subject area is some what niche,7,25,JZ124,Olliefant
22,4,c22_p4,B,low,0,35849,0.2764,0.3516,Yes Sir how to use the website and app link,"SB THANG SUAN KHAM, if you want help with editing, see [HELP_PAGE]. Other than that, feel free to ask more specific questions about what you need help with.",10,24,SB THANG SUAN KHAM,Zoozaz1
23,0,c23_p0,A,high,1,9242,0.0,0.301,"I made a minor edit to the article, Sweet Afton. I don't see that the edit was published. When will it be updated?","@ hmmm, I'm looking at [WIKILINK], and I see no recent edits. Perhaps it didn't save, you will need to publish the edit. Try again, and if you still don't see it, let me know and we can troubleshoot from there.",23,41,DiminishedC,CaptainEek
23,0,c23_p0,B,low,0,30535,0.0,0.301,"I created my account to publish a new theory on the Roman Dodecahedron, but am not sure this is the proper venue. Can you advise? If not, can you suggest one?
Thanks,
Joe Kugelman","Sadly unless your theory has been published and is discussed by independent researchers or outlets it is unlikely to be accepted as a Wikipedia article. Original research isn't accepted here, but there are plenty of venues elsewhere on the Internet, such as arXiv, stack exchange, etc.",34,46,JoeKugelman,Reconrabbit
23,1,c23_p1,A,high,1,10269,0.0002,0.3181,"Hello, I'm trying to update a page for an artist I work with and my edits have been deleted. I realize I used external links for my first edit so I tried again without links and it was still deleted. I am trying to add recent exhibitions to the list, should they by cited?
I'm not sure how to cite an exhibition?
Any help would be great. Thanks.","Artkamp209 Hi, I can't find any of your edits, were they under an IP or another account? Almost everything added to wikipedia should be cited, to [POLICY] that the information is accurate. You would cite an exhibition, for example, by finding a newspaper article written about the exhibition. You should only be using references to [POLICY], [POLICY] sources. Also, make sure you are properly disclosing your [POLICY] on your user page or in edit summaries. — (; )",68,77,Artkamp209,PerfectSoundWhatever
23,1,c23_p1,B,low,0,27760,0.0002,0.3181,"Hi, my intention was to correct an error in the Portuguese entry for Bezerros. The 'Mapa de Bezerros' and the coordinates given below it are for Garanhuns. I have discovered, however, that the incorrect information is not actually in the Bezerros page itself. Can you give me any hints about what help I need to read?","Hello there @, thank you for your efforts to improve Wikipedia. I think you wish to modify this coordinate in the [POLICY] of the [WIKILINK] page. If you open the editor in 'source editing' mode, you can modify the template parameters. Let me know if you need further help. Happy editing! ❯❯❯",56,52,Notsogreatdane,Raydann
23,2,c23_p2,A,high,1,173,0.1514,0.2156,"Hi there! Thanks for being a mentor! I'm interested in helping to provide/edit/update information about Pollinator Pathway, a grassroots organization that is working to create and connect pollinator habitat: [LINK] It started in Connecticut and Pathways are taking root in communities across the U.S. The wikipedia page has a listing for Pollinator Pathway, which is a localized design project, which has a great description on Wikipedia...but it doesn't mention anything about the newer, now larger organization. Additional info can be found here: [LINK] TIA!","Interesting - it seems like the Sarah Bergmann project and the Connecticut org aren't really related, other than sharing a name and similar ideas?
If so, I think the first step would be to make a new page at [DRAFT] and make sure you have good [POLICY] and can establish [POLICY]. Once that page looks good, we can move it into the main namespace, and then link between it and [WIKILINK].
Then, we could have a conversation about which one is the [POLICY] (if there is one).
Sound like a plan? Let me know if I can help along the way!",84,101,Buckeyeblooms,HundredVisionsAndRevisions
23,2,c23_p2,B,low,0,29222,0.1514,0.2156,"hello
I would like to pos one historical article. Could you assist please?","Hi Florian.Çota, and welcome to Wikipedia. Writing an article is a big step so it's recommended to start with smaller edits and improving articles that are already in the public space. Next, it looks like you're working on a draft that isn't in English. The good news is that [WIKILINK] has a lot of room for growth and it doesn't look like they have an article about the topic you have chosen. If you would like to work on the English Wikipedia, we would love to have you stick around! I highly recommend starting with the newcomer edit suggestions that are provided for you on your home page. This will give you a chance to learn how articles are structured and see the edits that others are doing. If you aren't ready to work on articles in the public space, [WIKILINK] is an excellent tool to learn the basics. I have posted some other helpful links on your talk page. Again, welcome!",13,161,Florian.Çota,Grumpylawnchair
23,3,c23_p3,A,high,1,37555,0.2764,0.1588,"Hi everyone!
So, I'm trying to update the ""Texas First Bank"" page since it's outdated, but I have a clear COI because I currently work there. However, I have created a drafted word doc of what I'd like to add. I just want to provide more history about the company as it's heavily lacking (with reliable sources, no bias and not linking back to our company's homepage).
Wanting to be transparent but also follow Wiki's Guidelines- just unsure exactly how to do so. We need to update it as ChatGPT derives a lot of info from here.
Just let me know! Any help is appreciated, thank you!","[LINK].
If you make reasonable, non-controversial edits, you should be fine.",107,11,Cburs,Fuddle
23,3,c23_p3,B,low,0,13900,0.2764,0.1588,"hey i do have a question about something, there is a important topic on a page that needs to be addressed and this has been discussed for maybe a year or two its about changing a political parties political position i think it is important to address the actually position of all parties on wikipedia and for some reason this has been addressed and agreed by many and its about reform uk political positioning.
i believe like many many others that it should be changed from ""right wing"" to ""right - far right"" because of multiple independent sources of major global media (e.g le monde, al jazeera, byline times, dw and the washington post) now consistently classifying the party as far right.
reform uk's policies on immigration, criminal justice, national identity and civil liberties - along with its anti-diversity stance and rhetoric around open borders and crime - are increasingly aligned with far right european populist movements like the AfD and PiS.
in contrast, the conservatives are already placed as centre right - right wing, so leaving reform uk in the same category no longer reflects the ideological gap between them.
id appreciate your advice or input on how to approach this change properly as me and many have been trying to discuss this but are being ignored. also in the archives you can see how many times this has been discussed. thank you","@: Hey! Sorry for the late reply, but I think I'm going to let the discussion [WIKILINK] continue and stand for itself, particularly as I'm not as knowledgable in this content area.",234,32,Jtttttt,Bsoyka
23,4,c23_p4,A,high,1,26009,0.2768,0.223,"Hi Nahida. I am writing an article on Carl Marsh after interviewing him for two stories and being surprised to find that someone of his stature has no Wiki. Today I added some new sections that quote extensively from one of my articles. When I tried to publish the changes, Wiki said the content was ""not properly deflated."" What does that mean? That I quote to much? How can I address whatever issue Wiki is finding with my edit? Thanks. Chris","I actually haven't seen a ""not properly deflated"" error yet. I'm sure someone knows though, so you could ask this at the [POLICY]. Unless I'm misunderstanding your question you should also check [POLICY].",80,33,Chriskingstl,Nahida
23,4,c23_p4,B,low,0,30649,0.2768,0.223,"good morning, I am very new to this and wondered if the suggested edit that I input the other day under the category of ""The Office of Thrift Supervision"" had been received, reviewed, considered & changed""?",@: Consider discuss the [WIKILINK] before editing. – ^w^,36,9,Mitchashlock,KuyaMoHirowo
24,0,c24_p0,A,high,1,15052,0.0001,0.4816,"Hello! I was wondering how to get a message appended to my user page that someone had, stating something along the lines of 'This user has no bad intentions. If they do something wrong, please notify them!' with a picture of an emoji with a halo. What is this and how do I append this to /my/ user page? :)","Update: I have figured it out. If you are going to reply, please do so! :)
Septonomic, great job figuring it out! If you need any help in the future, don't hesitate to message me again. Thanks,",59,35,Septonomic,EDG 543
24,0,c24_p0,B,low,0,20505,0.0001,0.4816,"Namastay,
Could you please tell me how to add a new page regarding any topic...?","Hello, Psychopomp3012, and welcome to Wikipedia! [HELP_PAGE] It describes the process, as well as some common problems that new editors run into. Creating a new article is one of the hardest things that you can do on Wikipedia, so you might want to try some easier tasks, like the ones described [POLICY], first. Please let me know if you have any questions!",15,61,Psychopomp3012,Extraordinary Writ
24,1,c24_p1,A,high,1,1090,0.3027,0.4402,"i’d like to start making pages for prominent kurdish politicians, i might need some help here and there. thank you!","Hi, and welcome to Wikipedia. I see you have already gotten started creating [WIKILINK]. Some resources that might help you are:
[HELP_PAGE]
[HELP_PAGE]
[POLICY]
I noticed that a couple of the sources you used are not accessible any more. Consider using a web archive site to archive any source you use so that it remains available even after the original source is gone. [HELP_PAGE] provides more information.",20,67,Klooperer,Whpq
24,1,c24_p1,B,low,0,6967,0.3027,0.4402,"Hi, I wanted to start a page for my client a well known medical doctor, any tips here?","CTanenbaum Hello, and welcome to Wikipedia. You can learn about writing new pages from [POLICY], but remember that writing an article from scratch is very difficult and knowledge of multiple policies and guidelines is required. I would recommend starting with editing articles already written here. You can get started with the [HELP_PAGE]. If you have any other questions, you can ask me here or ask over at the [POLICY].",18,68,CTanenbaum,Cyberdog958
24,2,c24_p2,A,high,1,5615,0.3027,0.4791,"I want to create a page about Roy Malkin, how would I go about doing this. I would really appreciate help!!","@ Hi, [POLICY] is a good place to start, following the reading of that. A good place to start working on a new article would be a subpage or a [POLICY] before publishing it in the main space.",21,38,MaximumReddock69,Jeffrey R. Clark
24,2,c24_p2,B,low,0,31769,0.3027,0.4791,I wasnt aware I had a page until today. How do I protect and develop my page?,"@ Hi, I recommend taking a look at [POLICY]. If you have any suggestions or would like to correct errors on the page about yourself, you can submit an [POLICY] for someone to look at (It is advised not to edit the article yourself as you have a [POLICY]). You do not have to do this with most articles, and you encouraged to edit them. If you are worried about vandalism, there are a large amount of editors who look almost every new edit at [POLICY], and it is taken care of there. Cheers, 🍷",17,95,John James Ward,Sophisticatedevening
24,3,c24_p3,A,high,1,34420,0.3027,0.5063,"Hi, i need your help in creating a page for my Boss in both English and Arabic","@: Creating an article for your boss is strongly discouraged and is a clear-cut example of conflict-of-interest editing ([POLICY]). The article will most likely be deleted.
However, you are welcome to contribute to topics unrelated to your job, family, and any other connections you may have, including yourself. Thank you. ~ ~",17,50,Ramyaamer77,Rusty Cat
