cluster,pair_rank,pair_id,role,retention,outcome,cid,mentee_dist,emb_cosine_sim,question_text,reply_text,question_words,reply_words,mentee_name,mentor_name
0,0,c0_p0,A,high,1,32336,0.305,0.9472,hello! I was wondering how to create a wiki,"C00lsl0th54 What do you mean by ""create a wiki"". Do you mean create an article, or to create a whole new database of articles on a topic that is separate from Wikipedia?",9,31,C00lsl0th54,Z1720
0,0,c0_p0,B,low,0,35466,0.305,0.9472,How to create a wiki,"@ You start out with edits that are much, much easier to do than writing an article, then you eventually go up to [POLICY]ion.",5,24,BlueWeeb,I dream of horses
0,1,c0_p1,A,high,1,652,1.9668,0.8307,How to create your own wiki page?,"Hi . Every editor has a [POLICY], you have created yours an it says [QUOTE] Am just a normal Man just..."" [/QUOTE]. If you meant a Wikipedia article, [HELP_PAGE] may help.",7,30,RipDBacorn,Commander Keane
0,1,c0_p1,B,low,0,32309,1.9668,0.8307,"hello, how do I make a wiki page and post it online for ever one to see.","Check out [HELP_PAGE]. That being said, it is best to get some editing experience. It's there something specific you want to write about? Happy editing.",17,25,Jamesharrisonlover72,Dafootballguy
0,2,c0_p2,A,high,1,28563,2.5363,0.8812,How do you create a wiki page?,"Hello! You can create a page directly on wikipedia if your account has the [POLICY] flag, which are automatically granted in accounts that are over 4 days old and has made at least 10 edits. However, creating a new page on Wikipedia is quite a workload, and often ends up in the page getting deleted for reasons, so I recommend starting out with adding information to articles to get the basics.
If you don't have the flag, you still can technically create articles through the [POLICY] process, which I highly recommend instead of making an article directly early on.",7,99,TheOmnipotentMod,AlphaBetaGamma
0,2,c0_p2,B,low,0,5250,2.5363,0.8812,How do i create my own wiki,"@ [POLICY] and [POLICY] may be of help to you. Creating an acceptable WP-article without having any experience in WP-editing is difficult, but if you have chosen an acceptable topic, it can be done.",7,34,Benji Sherman,Gråbergs Gråa Sång
0,3,c0_p3,A,high,1,25168,3.093,0.5682,How do I create a wiki page entery on mobile?,"Hi @, please see [POLICY]. I believe the general methods should be the same; feel free to ask again if you have specific difficulties.",10,24,Bellal Muhammed,Zippybonzo
0,3,c0_p3,B,low,0,14252,3.093,0.5682,hello. im new to wikipedia and we are trying to make a page for our group project. may u give us any idea on how to make a wiki page?,"Group4presention Good day and thank you for the question. First of all, since you are planning to create an article about your group that means you have a [POLICY] since you are affiliated/connected/associate with the group. As for you question, see below:
In order for a subject to warrant a page in the main space of Wikipedia, it must fulfill the criteria outlined in the Wikipedia guideline on notability, specifically the General Notability Guideline ([POLICY]).
GNG is defined as the subject must fulfill specific criteria to demonstrate [POLICY] from [POLICY] and [POLICY] sources. These sources should provide in-depth discussions about the subject rather than merely offering passing mentions. This requirement is essential for verification, which is a core policy of Wikipedia. If a source is affiliated/associated/connected with the subject—such as the subject's marketing team, company, social media platforms, information in interviews of the subject or any self-published information—this indicates a lack of independence. Consequently, such sources cannot be utilized to satisfy the notability guidelines. Sources originating from educational institutions, government entities, foundations, social media platforms, and private companies are regarded as unreliable. In contrast, materials published by ""major"" newspapers and ""reputable"" books are typically considered reliable sources.
I recommend that you read [POLICY] and adhere to the provided instructions before beginning the creation of an article. Regards.",30,216,Group4presention,Cassiopeia
0,4,c0_p4,A,high,1,36131,3.4025,0.8602,How do I create a brand new wiki page?,"Hi, Lukerog02!
If you want to create a article about a brand please read the [POLICY] and [HELP_PAGE]. Once you have read and understand the guidelines you can proceed to [HELP_PAGE].",9,30,Lukerog02,Royiswariii
0,4,c0_p4,B,low,0,2441,3.4025,0.8602,How do I begin to edit and put up a new wiki page ?,Welcome to Wikipedia! Here is a good way to start your first article: [POLICY] LMK of any specific questions.,13,19,Essel Ekuban,Lfstevens
1,0,c1_p0,A,high,1,21146,3.9834,0.7651,How to add a new article?,Hi Nasya Rosalind you can find everything you need to know about creating an article at [POLICY].,6,15,Nasya Rosalind,Fieryninja
1,0,c1_p0,B,low,0,15313,3.9834,0.7651,list a new article,"GD Property Solicitors Sorry, I'm not sure I understand what exactly you need help with. If you'd like to start a new article, I recommend the [POLICY] process. Do note that [POLICY] are not permissible on Wikipedia, and [POLICY] is against policy. '",4,40,GD Property Solicitors,AviationFreak
1,1,c1_p1,A,high,1,15604,13.4809,0.5078,what are some good things to add to an article?,"@ That's rather too general a question to have a simple answer. Start by reading [POLICY]. Then take a look at some topics you already know something about and ask yourself ""has Wikipedia covered this in sufficient detail that a reader gets a useful basic introduction?"". If the answer is ""no"", then try to improve the article without adding [POLICY]: we only allow additions that are sourced to already-published material. Ask me again here on my Talk Page if you need further help, and enjoy the experience of contributing to the world's biggest repository of reliable information.",10,97,Ashhwoodd,Michael D. Turnbull
1,1,c1_p1,B,low,0,26252,13.4809,0.5078,"I want write new articel in home page, how to?",What do you want to write an article about?,10,9,English1.id,Voorts
1,2,c1_p2,A,high,1,35674,15.9993,0.8291,"Hello, how do I add my own article on here?",":DaDestroyerr, You have to go through [POLICY].",10,6,DaDestroyerr,Zoozaz1
1,2,c1_p2,B,low,0,10612,15.9993,0.8291,"hello
can you please show me how to add a new article. thank you.","Hello Mdoutim, thanks for reaching out. The guide at [POLICY] gives a general overview on writing your first article. If you are new to editing, I recommend making other contributions first as creating an article has a high level of difficulty.",14,40,Mdoutim,Fritzmann2002
2,0,c2_p0,A,high,1,143,0.9151,0.5199,"How do I begin as a new editor? I feel hesitant to edit. I feel like I might make the original text worse?
Do you have any types? Grammar-wise and tone-wise, so that I can strengthen my informative writing and proofreading.","Welcome to Wikipedia, @! It's OK to feel a little hesitant as there are a lot of rules here, but the [POLICY] and [POLICY] have what you need to know to get started. You should have a personal homepage with suggested edits to start with, but only pick the ones that interest you or you feel confident about. Keep reading articles in your areas of interest to get a feel for the style and layout of articles. Don't worry, everyone makes mistakes sometimes, just be open to feedback from other editors, and have fun! ' ([POLICY] · · · [WIKILINK])",41,100,Boybingo,ClaudineChionh
2,0,c2_p0,B,low,0,34858,0.9151,0.5199,Hey where do i start my journey of editung,"I would recommend checking out [POLICY]. Good luck on your journey! Signed, 🩷
==[POLICY] nomination of [WIKILINK]==
[QUOTE] quote=If this is the first article that you have created, you may want to read [POLICY].You may want to consider using the [POLICY] width=20%|align=right [/QUOTE]
A tag has been placed on [WIKILINK] requesting that it be speedily deleted from Wikipedia. This has been done under [POLICY], because the page appears to be a repost of material that was previously deleted following a [POLICY], such as at [POLICY]. When a page has substantially identical content to that of a page deleted after a discussion, and any changes in the content do not address the reasons for which the material was previously deleted, it may be deleted at any time.
If you think this page should not be deleted for this reason, you may contest the nomination by [WIKILINK] and clicking the button labelled ""Contest this speedy deletion"". This will give you the opportunity to explain why you believe the page should not be deleted. However, be aware that once a page is tagged for speedy deletion, it may be deleted without delay. Please do not remove the speedy deletion tag from the page yourself, but do not hesitate to add information in line with [POLICY]. If the page is deleted, and you wish to retrieve the deleted material for future reference or improvement, then please contact the , or if you have already done so, you can place a request [POLICY].",9,246,Pamgrayolo,Coolgurl5555
2,1,c2_p1,A,high,1,8454,3.3949,0.64,Hey Marchjuly I'd like to ask what are some of the best ways to get experience in editing and some tips you have for a user new to editing.,Hi Jase sanders. There are some suggestions found in [WIKILINK] that you might find helpful. I've will add a general information notification to your user talk page which also contain links to other pages you might find helpful.,28,36,Jase sanders,Marchjuly
2,1,c2_p1,B,low,0,3853,3.3949,0.64,"Hello Rosie, I would like to know a few tips on how to be a good editor and easily find errors in articles or other edits",Hi MCSRVR01 and welcome to Wikipedia. A good place to start is this [HELP_PAGE]. I also left a with a few other helpful links. Happy editing!,26,25,MCSRVR01,Rosiestep
2,2,c2_p2,A,high,1,37716,4.1319,0.5614,Hello Mr how I can be good editor,Hello @. Welcome to Wikipedia. I have noticied some messages on . There are lots of good informative links avaialble there. Please have a look and contribute to the topics that you are intreseted about. That's it. :),8,36,Mr.Besya,Gnoeee
2,2,c2_p2,B,low,0,34858,4.1319,0.5614,Hey where do i start my journey of editung,"I would recommend checking out [POLICY]. Good luck on your journey! Signed, 🩷
==[POLICY] nomination of [WIKILINK]==
[QUOTE] quote=If this is the first article that you have created, you may want to read [POLICY].You may want to consider using the [POLICY] width=20%|align=right [/QUOTE]
A tag has been placed on [WIKILINK] requesting that it be speedily deleted from Wikipedia. This has been done under [POLICY], because the page appears to be a repost of material that was previously deleted following a [POLICY], such as at [POLICY]. When a page has substantially identical content to that of a page deleted after a discussion, and any changes in the content do not address the reasons for which the material was previously deleted, it may be deleted at any time.
If you think this page should not be deleted for this reason, you may contest the nomination by [WIKILINK] and clicking the button labelled ""Contest this speedy deletion"". This will give you the opportunity to explain why you believe the page should not be deleted. However, be aware that once a page is tagged for speedy deletion, it may be deleted without delay. Please do not remove the speedy deletion tag from the page yourself, but do not hesitate to add information in line with [POLICY]. If the page is deleted, and you wish to retrieve the deleted material for future reference or improvement, then please contact the , or if you have already done so, you can place a request [POLICY].",9,246,Pamgrayolo,Coolgurl5555
2,3,c2_p3,A,high,1,2228,4.2315,0.5826,Hi Mujinga! Do you have any recommendations for a new editor who is trying to find their way now that they actually have an account?,Hi @ welcoem to wikipedia! I've put some handy hints at . Happy editing!,24,13,TheClocksAlwaysTurn,Mujinga
2,3,c2_p3,B,low,0,23721,4.2315,0.5826,What is your advice i want to edit and write articles I also heard that moderators delete contributions that newcomers make is that true? Thank you in advance,"@ Hello! As for writing articles, see [HELP_PAGE]. As for editing them, click the ""edit"" button in the top right. As for the contribution deleting, [POLICY], yes. Hope this helps! ∫",28,31,Magicianko,Mwwv
2,4,c2_p4,A,high,1,6230,4.2324,0.701,Hello. Do you have any tips for me as a first time editor,@ Pick articles of your interest and read them. Start making small improvements and fix any typos. Add some references/citations if you have any. -- ( •,13,26,Urban Destruction 141122 - Thugz Queen,Satdeep Gill
2,4,c2_p4,B,low,0,15957,4.2324,0.701,Please do you have a guide on how I can become an editor,"@, congratulations! You're an editor! You've just made your first edit here, to my talk page. If you want more help, see [HELP_PAGE] for a beginners guide, [POLICY] for easy tasks, and feel free to ask questions here or at the [POLICY]. One quick note — you will probably need to change your username, per our [POLICY], as a username shouldn't imply that you are an organization or more than one person. You can request this here [POLICY]. ( • )",13,78,Fintech today news,Wasianpower
3,0,c3_p0,A,high,1,373,1.1839,0.8364,Mentor I want to wrote my own article how can I write it,"Welcome, @. I've added some links to your talk page to help you get started. You should learn how to edit and how wikipedia works before trying to write an article. [POLICY] also provides some advice.",13,36,Phawelihle,Schazjmd
3,0,c3_p0,B,low,0,33815,1.1839,0.8364,how can i write my own article,@: You can start a draft at [POLICY]! ~ ~,7,8,Nilsnils023,Rusty Cat
3,1,c3_p1,A,high,1,10694,2.883,0.7796,write an article,"Hi Abarrahman, are you asking how to write an article? You can find instructions at [HELP_PAGE]. Let me know if you have other questions! —",3,23,Abarrahman,Wugapodes
3,1,c3_p1,B,low,0,20564,2.883,0.7796,Who do i write a new article,"Thortheregnarok Check [HELP_PAGE] and [POLICY] - ( | )
AssumeGoodWraith, Thank you!",7,11,Thortheregnarok,ARoseWolf
3,2,c3_p2,A,high,1,23344,3.5582,0.6869,How can I creat article which will approved easily.,"Hi , welcome to Wikipedia! You've asked a quite broad question and I need more details (like what subject you intend to write the article on, what sources you have gathered) to provide a more specific answer. In general, [HELP_PAGE] is quite a good place to start. However, I believe most new articles by newer users end up not being published, especially if you have a [POLICY] with the subject. It is likely to be a waste of time and if you are interested in contributing in general, I would recommend going through [HELP_PAGE] and picking a task in our [POLICY].",9,100,Kabilavutto,Justiyaya
3,2,c3_p2,B,low,0,28072,3.5582,0.6869,How can I draft my own article,"Your own Article, do you mean how can you create a draft for a new article?.",7,16,Ahsyegeh,UndercoverClassicist
3,3,c3_p3,A,high,1,5330,3.834,0.6941,How do I write articles and what are the guildline,"@ Hello! Making an acceptable WP-article without knowing how to edit WP is hard. A common advice is to ""just"" edit for a while first, to try to get a hang of this place.
That said, your first hurdle is ""Can a WP-article about your chosen subject be written at all?"" Start with reading [POLICY]. If you conclude ""Yeah, I have those sources, no problem!"", move on to [POLICY]. If your choice of topic fails [POLICY], the article will not be accepted. If you decide to go ahead, you need to learn how to add references correctly, [POLICY] can help with that. This is crucial, and I can't stress that enough. Really. If you intend to write about a living person, read [POLICY]. If you intend to write about yourself ([POLICY]), the short advice is ""don't.""",10,136,Mikewriteszzz,Gråbergs Gråa Sång
3,3,c3_p3,B,low,0,28224,3.834,0.6941,I want to write an article,See [HELP_PAGE].,6,2,Akeze,Destinyokhiria
3,4,c3_p4,A,high,1,8758,4.3096,0.7187,"Hello sir,I want to known how an article is written","Lukman Abdulmalik, what specifically about an article would you like to know about? That is a very broad topic. (Very Busy)",10,19,Lukman Abdulmalik,Yoshi24517
3,4,c3_p4,B,low,0,11927,4.3096,0.7187,I'm ready to write an article. What do I need to know?,"Hello @, welcome to Wikipedia. The key things you need to know are: the topic must be notable (covered in multiple [POLICY], [POLICY]), the article must be written from a [POLICY], and everything must be verifiable through your citations. You can also practice safely by starting in your sandbox before moving to the main space. Please read [HELP_PAGE] for more information. If you need help at any step, feel free to ask.",12,72,Gilgamesh95,Idoghor Melody
4,0,c4_p0,A,high,1,3657,0.0,0.6546,Hi I'm Blueberry Harumi and may I ask how does editing new pages work if I don't have the knowledge of the text at hand since I'm new here as this is my first day working with Wikipedia,"Blueberry Harumi Why did you become a registered Wikipedia user?
Cos I want to spread the knowledge I have to other people
Hi Blueberry Harumi, and apologies for the delayed reply. What do you mean by not having knowledge of the text at hand?",36,40,Blueberry Harumi,Calliopejen1
4,0,c4_p0,B,low,0,26910,0.0,0.6546,So can I edit anything on Wikipedia?,"@: You can edit any page at Wikipedia at any time. Just make sure that those edits are constructive; see [POLICY] to find out more. Regards,",7,26,Kvhjigvon,Nythar
4,1,c4_p1,A,high,1,28724,0.0,0.6769,hey. this is my first time ever editing. is there any video or step by step process i can look over. i think before i go and edit i should figure out how wikipedia edits work. i tried to edit but not sure what i was doing.,"Oh, hello there! Wikipedia may look like it had an absurd list of rules, but there aren't too much to look at if you aren't planning to do literally everything you can to help Wikipedia. If you're planning on writing content, there are much less complicated things. Simply do not copy-paste copyrighted content (this applies to the entire internet), cite ""[POLICY]"" in Wikipedia's standards ([POLICY]) when you add new facts, and respect the existing time/English variant. Please don't use ChatGPT and those AI tools for the time being as well. They're not 100% banned, but they are pretty notorious for causing [POLICY].",47,102,TheCrowdSourcedOne,AlphaBetaGamma
4,1,c4_p1,B,low,0,23987,0.0,0.6769,"Hello sir/ma
How can I start my editing on Wikipedia",Welcome @! Please have a read of [HELP_PAGE]. :,10,8,Crypton304,Bunnypranav
4,2,c4_p2,A,high,1,23291,0.1525,0.7377,how do you start editing an article on Wikipedia using my homepage,", what do you mean, [QUOTE] 1=using my homepage [/QUOTE]? —",12,9,Tricia190,Qwerfjkl
4,2,c4_p2,B,low,0,31761,0.1525,0.7377,How do I edit on Wikipedia? I'm new to editing.,"It is fairly complicated, but I suggest reading [HELP_PAGE]! HwyNerd",10,10,Gerald the fish,HwyNerd Mike
4,3,c4_p3,A,high,1,13165,0.6101,0.804,"I do not understand a thing about wikipedia editing, help",Ma89eo1 Please see the [POLICY] interactive tutorial. It should help show you the basics. Please let me know if you have any further questions.,10,23,Ma89eo1,TheSandDoctor
4,3,c4_p3,B,low,0,5801,0.6101,0.804,How do I edit on Wikipedia,"Hello, Ochediameh. [HELP_PAGE] is a good introduction. Please avoid making major changes to articles until you know what you are doing a little bit better.",6,24,Ochediameh,Cullen328
4,4,c4_p4,A,high,1,27235,0.6865,0.7451,"Hi, I am new here. I have knowledge of HTML. Can I edit wikipedia? How to edit and how I should start?","@ hi. Yes, you are absolutely welcome to edit Wikipedia! [HELP_PAGE] would be a great place to start.",22,18,Arbaz Thakur,CanonNi
4,4,c4_p4,B,low,0,5801,0.6865,0.7451,How do I edit on Wikipedia,"Hello, Ochediameh. [HELP_PAGE] is a good introduction. Please avoid making major changes to articles until you know what you are doing a little bit better.",6,24,Ochediameh,Cullen328
5,0,c5_p0,A,high,1,17378,0.305,0.5932,"So I joined today, and I go on Wikipedia every day, so could you please explain to me some of the basic rules of Wikipedia? Thanks!","Hi , and welcome to Wikipedia! [POLICY] are the five fundamental principles which govern everything we do. If you want more, you can check out our three core content policies: everything we put in an article must be [POLICY] and [POLICY], and cannot be an editor's [POLICY]. Finally, we have to exercise great care when [POLICY]. I've left you a message on your talk page which gives you some additional links, but as long as you follow the five pillars, you'll do fine :) Best,",26,83,ILoveMyDogFrankie,HouseBlaster
5,0,c5_p0,B,low,0,3728,0.305,0.5932,"Hi, how can i contribute to Wikipedia","Hi @, I'd recommend that you check out [POLICY] to start!",7,11,Idegwu Oche Samuel,Calliopejen1
5,1,c5_p1,A,high,1,6388,0.6865,0.5595,"Hi, I was assigned to you if I'm not mistaken and I wish to know more about Wikipedia writing","Hello, , and welcome to Wikipedia! The most important thing to un=derstand is that this is an encyclopaedia. The topics must meet our [POLICY], and everything said here must be based on already published, high quality sources. So no personal opinions, personal blogs or social media acocunts, or stuff that you simply happen to know. Everything here that could be challenged must be [POLICY], and you will learn how to add citations to support new content. Writing new articles is very very hard, especially for a new editor. So start slowly and learn the basics of editing and improving articles. You have a 'Homepage' tab which offers you an opportunity to make small improvements in one of several different areas to get you off to a good start.
We may point users to various guidance, help or policy pages, and we expect they will take the time to read and understand these. So, I'll leave leave you a welcome message on your talk page with a number of important links. But you may also like to visit this help page: [HELP_PAGE]. Good luck!",19,182,Obi K Chijioke,Nick Moyes
5,1,c5_p1,B,low,0,21224,0.6865,0.5595,can you introduce me to wikipedia,"I'd be glad to, Way too crazy! Since the wikipedia is all about editing articles and editing content, perhaps a good first step would be to think of topic areas you are interested in? For example, I often edit articles related to my home team, books, and historical eras I'm interested in. — ♠ ( / ) [POLICY] — [WIKILINK] ♠",6,53,Way too crazy,Ixtal
5,2,c5_p2,A,high,1,26017,1.0536,0.4499,"Hi Nahida, I have a curiosity.
How is the integrity of Wikipedia content ensured? Are all pages double checked with external sources? Thank you!",:Pages require sources before content can be added. You're probably looking for [POLICY].,23,13,Tferracina,Nahida
5,2,c5_p2,B,low,0,35861,1.0536,0.4499,What's Wikipedia all about,"UCFX, it's a free, volunteer-run encyclopedia meant to encompass all human knowledge.",4,11,UCFX,Zoozaz1
5,3,c5_p3,A,high,1,14930,1.1211,0.6313,Hi I am new to Wikipedia. Plz guide me,"@: I reccomend checking out [POLICY], which is a basic introduction to editing Wikipedia. (, , )",9,16,Bindu Palei,Leonidlednev
5,3,c5_p3,B,low,0,4607,1.1211,0.6313,"Hello I want to know
How to appear on Wikipedia?","Kelvin0766 Well, you already have a user account and a user page with a few notes about yourself. I assume, then, that you are asking about creating an article about yourself. I'll answer based on that assumption.
The subjects for our articles are generally chosen by the editing community rather than by request. While there is a venue where you can request articles, a request for an article creation on oneself is likely to be declined. You can visit our 'requests for articles' page at [POLICY].
It's also important to realise that Wikipedia strongly discourages articles written by the subjects themselves or by others close to a subject because of the difficulty in writing objectively about yourself, your family, or your work. Please see [POLICY] for our guidelines on writing about yourself or topics you are personally involved with. While keeping in mind conflict of interest issues, please note that if someone does create an article about you, you should feel more than welcome to edit the article's Talk page to ensure that each piece of information is factual and complying with our ""Biography of Living Persons"" policy. This policy can be viewed at [POLICY].
You may also like to read [POLICY] for a guideline on the type of articles that are generally accepted.
If my assumption was incorrect and your question is about something else, let me know.",10,228,Kelvin0766,Glane23
5,4,c5_p4,A,high,1,33782,1.1839,0.6322,"Hello! Do you know if there's any way I can make my own Wikipedia ""post""? Thank you!","Wikipedia is not a social media platform and does not have ""posts"". If you'd like to write an article, see [HELP_PAGE].",17,21,Mags6767,Rambley
5,4,c5_p4,B,low,0,6916,1.1839,0.6322,"Hi , I want to add my data do wikipedia. What should I do?","Hezzal Smith Hello, and welcome to Wikipedia. I’m not sure what you mean by add your data. Can you clarify what you would like?",13,22,Hezzal Smith,Cyberdog958
7,0,c7_p0,A,high,1,14840,0.5117,0.6011,"How can I add new information, publish new content?","@: The article about the subject already exists at [WIKILINK]. If you want to add more information about it, [POLICY] and add it yourself, but make sure to back up your addition with a [POLICY] (see [HELP_PAGE] for help on referencing). -- (, , )",9,44,Jxstin670,Leonidlednev
7,0,c7_p0,B,low,0,5268,0.5117,0.6011,How can I add my story or someone else's story,@ [POLICY] may be of help to you. See also [POLICY].,10,11,Calleb Charles,Gråbergs Gråa Sång
